sentiment,status_id,user_id,text,source,is_quote,lang,favourites_count,retweet_count
True,1240790155008585728,428750186,Welcome to #AWSchat to discuss #COVID19 and its impact on #surgery and our communities https://t.co/i7uFuu7kBl,TweetDeck,False,en,45478,7
False,1240790171404075009,999683160429363200,"Coronavirus Top 10 Countries Death CountChina 🇨🇳: 3,237Italy 🇮🇹: 2,978Iran 🇮🇷: 1,135Spain 🇪🇸: 623France 🇫🇷: 148US 🇺🇸: 118Korea, South 🇰🇷: 84United Kingdom 🇬🇧: 72Netherlands 🇳🇱: 58Japan 🇯🇵: 29😷☠️😷☠️😷☠️😷#coronavirus #covid19 #coronahttps://t.co/7nOypYVuft",Tweet Embed Cor,False,en,109,0
False,1240790184846856192,28558205,"How does #COVID19 spread? Through close contact between people and droplets of coughs or sneezes and when a person touches a surface with the virus on it and then touches their nose, mouth, or eyes. Stay informed: https://t.co/Rxo4nLnvvL #Coronavirus https://t.co/2D6EVkslxd",Sprout Social,False,en,1654,1
False,1240790183911579656,875207377728950277,How #tech can be the saviour in #corona #lockdown!https://t.co/zv1YtCXyhc#CoronavirusOutbreak #coronavirus #Technology #Covid19 #CoronaVirusChallenge #HealthTech https://t.co/lR6I1q6iT9,Buffer,False,en,324,0
False,1240790224231370753,152977510,#Technology aids in #corona battle!https://t.co/Mx6NIBCuag#Technology #HealthTech #Corona #Coronavirus #CoronaVirusChallenge #CoronavirusOutbreak https://t.co/9wwaCCzEu1,Buffer,False,en,157,0
False,1240790236889833475,21914359,Corona pandemic opens floodgates for #AntiSemitism | https://t.co/s60R4dB9N8 #Jews #Coronavirus #COVAD19 #Arabs #Turkey #Palestine #Israel https://t.co/hIWQi03dyL,Buffer,False,en,1240,0
True,1240790238546534400,875579780506066945,#Techgiants are getting creative to manage the #COVID19 crisis!https://t.co/ZGbXT1RfAU#Technology #HealthTech #Corona #Coronavirus #CoronaVirusChallenge #CoronavirusOutbreak https://t.co/obmunL3jJ8,Buffer,False,en,246,0
False,1240790255969677315,1071852296391266304,@BorisJohnson You say your not putting London on lockdown but are you going to put restrictions on people’s movements in London? #CoronaVirusUpdate #CoronaCrisis #Corvid19uk #coronavirus #corona,Twitter for iPhone,False,en,38,0
True,1240790311808438272,479220294,"We are living in uncertain times, and protecting yourself and your family from infection is paramount. The WHO website has up to the moment information about what to do during this trying time. Stay safe!https://t.co/kiyzTuCj1h#coronaupdate #covid19 #corona #safetyfirst https://t.co/LDPAy3mZOe",Hootsuite Inc.,False,en,351,0
False,1240790345975320577,914904555191701505,"If you’re from #Miami don’t come up to #Broward now that y’all are on #lockdown from the #Coronavirus! Y’all ain’t like us before, so don’t play like y’all do now. We don’t want y’all germs 😒 But for real, fck this Corona shit!",Twitter for iPhone,False,en,498,1
True,1240790350177939456,2457194089,"We are living in uncertain times, and protecting yourself and your family from infection is paramount. The WHO website has up to the moment information about what to do during this trying time. Stay safe!https://t.co/FKuWKkQAEj#coronaupdate #covid19 #corona #safetyfirst https://t.co/rLaoW5fBjr",Hootsuite Inc.,False,en,506,0
False,1240790351461277696,111565918,"“You’ve got once in a lifetime opportunity to #stay at #home, relax and to save the World.” Don’t screw this up! 🙌🏻Self Isolation is the immediate Solution 😇#SaveWorld#COVID2019#CoronavirusOutbreakindia #CoronavirusOutbreak #Corona #StaySafeStayHome #StaySafe",Twitter for iPhone,False,en,9409,0
False,1240790369123684352,1217175602756771840,A part of our every night live video❤️ Follow us on instagram to listen live music every day! Instagram Larudche❤️ #music #blues #singer #livemusic #independantartist #TogetherAtHome #StayAtHomeChallenge #corona #killingmesoftly #larudche #COVID19 #lovemusic https://t.co/bJ4BAaHd4C,Twitter for iPhone,False,en,11,0
False,1240790383862452224,518246720,👑 Quaran-Tings 👑  Vol. 1 https://t.co/Xu508F1t6L via @YouTube #corona #music #coronavirus #covid19 #StayAtHomeChallenge,Twitter for iPhone,False,en,1123,0
False,1240790400329297920,73377501,"...of course, a Sharpie 🤦‍♂️#coronavirus #COVID #TrumpVirus https://t.co/Tnxp6xVUGL",Twitter for iPhone,True,en,115294,0
False,1240790596295340032,817464143460478976,"This is beyond insider information. A week before he dumped a big chunk of his stock, @SenatorBurr published an editorial reassuring Americans that the Government had the crisis in hand. #GOPCorruptionOverCountry.#COVID19https://t.co/VT6iYnQEW3",Twitter Web App,False,en,12664,0
False,1240790659608596480,766878593007792128,.@jabinbotsford:  @realdonaldtrump is an idiot in charge of our very lives.  He focuses on blaming China instead of admitting that for the 2.5 months he claimed #Covid19 was a HOAX - he KNEW the virus was sweeping thru our nation.  We pay the price for his vindictiveness &amp; greed. https://t.co/Djuq98UQOd,Twitter Web App,True,en,92714,2
False,1240790673013571585,385195083,Me finding out @smart_MS3 has corona virus . Please take me instead. @Joepcro #coronavirus #marcussmart https://t.co/aqyTdMBuNF,Twitter for iPhone,False,en,25367,0
False,1240790694131896320,70586784,"NO MORE NEED TO BE SAID! ...#coronavirus #corona #virus #washyourhands @ Surfers Paradise, Queensland https://t.co/XQXjhF4XdO",Instagram,False,en,936,0
False,1240790730278342662,175500453,Testing for the corona virus in Sedgwick County. https://t.co/AjXOkOlKgh #CoronaVirusUpdate #Covid_19 #WichitaArea,Twitter Web App,False,en,1124,3
False,1240790773328760833,1097697352721354752,"Call your Senators to demand a #MoralStimulus. Dial (855) 999-1663 and tell them: Put people before profits in their Corona response by providing health, housing, and economic stability for all, and extra support for those most vulnerable. #Covid19 https://t.co/ptFySzQYpI",Twitter for iPhone,False,en,1380,2
False,1240790863690657792,63226499,"2 Lakers test positive for the Corona virus. It will be interesting when they narrow down just ""how"" the virus was transmitted. From the basketball itself? #NBA #CoronavirusOutbreak",Twitter for Android,False,en,9871,0
False,1240790869084602368,814126494,Hermione Granger would have already cured Corona. #HarryPotter #coronavirus,Twitter for iPhone,False,en,4208,1
True,1240790891436158985,1058390650817658881,@ForumAtheist When all is said and doneThe one thing we can truly rely on is our own ingenuity.#coronavirus#COVID19 #corona                                            @DazzDzatron https://t.co/YT4WliYHrU,Twitter Web App,False,en,36007,0
False,1240790940299792385,129754786,Flu season lo #FLUmovie movie chusa....not bad actually. But literally same script like corona. @PrimeVideo #Covid_19 #coronavirus https://t.co/CAp59lMO4j,Twitter for iPhone,False,en,9525,0
False,1240790988697690113,269970260,Gov. Gavin Newsom estimates 56% of Californians will have the Corona Virus within 8 weeks. I live in L.A. California is now CLOSED. No matter what invite you get to come to the state..PLEASE stay home. 😷😷😷😷😷 #QuarentineLife #CoronaVirusUpdate #Corona #COVID19 #Covid_19 https://t.co/06oFcSTbcA,Twitter Web App,False,en,416,0
False,1240791069652107265,1079797464813764608,"this isn’t fair, i can’t believe i’m done year 11 already. wtf are we meant to do for 6 months. i’m gonna be predicted U’s. no pride, concerts, NCS or camp. fuck this shit man i want my time in secondary back #gcse2020 #classof2020 #Covid_19 fuck u corona https://t.co/bY0YgC0x3c",Twitter for iPhone,False,en,9676,5
False,1240791114313019393,284760236,#coronavirus HOLY SHIT! Bill Gates predicted the corona virus in 2015. It fell on deaf ears! We need to listen to brilliant minds ! Please rtwt https://t.co/26f2rJaIlX,Twitter for iPhone,False,en,99860,0
False,1240791120428359680,722825378373304320,Cute Mickey Minnie Wash Your Hands Doormat - Non Slip https://t.co/PsimN4PCGYHome Apartment Decor Front Door Mat#WashYourHands #HOMEcoming #behombrefied #lockdown #SafeHands #cleaningtips #CoronaVirusUpdate #coronavirus #corona #caronavirusoutbreak #BREAKING #home #homesafe https://t.co/QkW37e3q5t,Twitter Web App,False,en,222,0
False,1240791129504825344,191026259,Here's something practical you can do to help scientists tackle #COVID19 - donate spare CPU/GPU time to working out its structure and finding target antibodies.  We've just put our render cluster on it when it's not in use (i.e. which is most of the time at the moment). https://t.co/7dp3ExXAIr,Twitter Web App,True,en,163,2
False,1240791173691838464,86773118,"'If I get corona, I get corona': Coronavirus pandemic doesn't slow spring breakers' party https://t.co/RNRhjuTWwL You know you're an old dude when you say to yourself, ""What's with this younger generation."" #COVID19 #CoronaCrisis https://t.co/L7hcRaevDd",Buffer,False,en,46324,3
False,1240791299231383555,163705355,"This is the strangest-looking collection of young people ever interviewed at one time, in one place.Like, really look at these people!#coronavirus https://t.co/RCRYU53I5j",Twitter for Android,True,en,10179,0
False,1240791339601661953,46266457,In these crazy times this t-shirt seemed appropriate! The Invaders and Madness madnessband #music #corona #covid_19 #spaceinvaders #friday #weightloss #weightlossjourney #fitness #fitnessmotivation #fitover50… https://t.co/hn6890VnWG,Instagram,False,en,2801,0
False,1240791353803538434,609543,Vijay hits on just about EVERY toipic some of us have been bitching about for many years. If #COVID19 does bring the kinds of change he shares then we'll all be better off. https://t.co/isACP4EgKI,Twitter Web App,True,en,9918,1
False,1240791392575787008,21710078,Why is there no mention of African nations under attack by coronavirus in the American mainstream media? Here is news on Africa. #Africa #Coronavirus #Media #Newshttps://t.co/KDHB8IlAhy,Twitter Web App,False,en,20,0
False,1240791480387674114,182144844,"if you’re freaking out about the corona virus, this is the video to watch. stay safe, calm, n content. ❤️https://t.co/KohbvBwNUG#coronavirus #COVID #Covid_19 #COVIDー19",Twitter for iPhone,False,en,57481,3
False,1240791497135570945,377759240,Check out JoJoSpatafora's video! #TikTok #coronavirus #corona #sanitize  https://t.co/RXfEcU3kJ1,Twitter for iPhone,False,en,7239,0
False,1240791516706152450,843518915066118147,#Covid19InSA#Covid_19 #CoronavirusInSA  #Covid19InSA 70% x Total population of 57 million is 40 Million people70% of South Africans likely to get Corona according to Health Minister40 Miter..... Chizos https://t.co/XdGwDRriPI,Twitter for iPhone,False,en,7779,0
False,1240791550696833024,107461274,The population pyramid of the most corona affected countries compared to East Africa. The red represents the age group above 65 and the number in the braces is the percentage #WHO #coronavirus #CoronaVirusUpdate #CoronaVirusChallenge #Ethiopia https://t.co/DB70xWHtQl,Twitter Web App,False,en,111,0
False,1240791568040120320,2281561706,Staying fit during corona virus quarantine!#fit #coronavirus #Equinox #workout https://t.co/QfZKvOjQtW,Twitter for iPhone,False,en,64,0
False,1240791575598264321,95854178,"Self Help Group members of Odisha Livelihoods Mission, PR&amp;DW Dept. engaged in production of face masks. Working towards fighting Corona Outbreak. #PRDeptOdisha #OLM #SVEP #COVID19 #socialEntprs #hfwOdisha #NarendraModi #otvnews #WHO #mohfw_india #FightCOVID19 https://t.co/MFsEsJEODm",Twitter Web App,False,en,56,0
False,1240791586545549313,1066844755752042496,corona fucked up everything #coronavirus,Twitter for iPhone,False,en,2560,0
False,1240791647664984066,1075704375614541824,Scene from the tapestry that will depict the Corona Virus Pandemic for future generations. #coronavirus https://t.co/eypFgYgQk3,Twitter for Android,False,en,3769,1
False,1240791672520183809,953061308621991936,I agree.. #coronavirus https://t.co/048lHy4lMe,Twitter for Android,True,en,53230,0
False,1240791692766326785,379319333,"You: “The only corona I want is a beer from Mexico”Me, an intellectual: “tHe OnLy CoRoNa   I wAnT iS a BeEr FrOm MeXiCo” #quarantinelife #corona #covid_19 https://t.co/HGb1YL6lYB",Instagram,False,en,152,0
False,1240791709665067015,2776025553,The ball fell on the street 😂When tennis is still life💙#stayathomechallenge #stayhome#corona #coronavirus#tennis #sports #egypt #nadal #viral #tennislover #tennisworld#tennislife #2020 #tennistime #tennistv https://t.co/E7KbtYpGoq,Twitter for Android,False,en,1,0
False,1240791718531936257,1174202482802745349,"Come join me #StreamingLive on #MixerCelebratory #dbzkakarot ""I just got laid off from my job today, for real, thanks Corona "" Edition.  #coronavirus#laidoffMight as well laugh over it, right?https://t.co/BCKgyJOmnL #Mixer",Twitter for Android,False,en,23,0
False,1240791768548782080,98551754,😭😭 get well soon Mr. Mayor #COVID19indonesia #Covid19 https://t.co/ke5dQiatCo,Twitter for iPhone,True,en,702,0
False,1240791787318456323,913758747444596736,I don't *want* anyone to get corona virus and die... but if someone *had* to... #covid19UK #coronavirus https://t.co/vx3VM7Hzxy,Twitter for Android,True,en,41329,0
False,1240791790543876100,55112390,I’ve been binge watching @Jellesmarbles and @AnimalPlanet • next step is to restrict news outlets so my husband stops thinking he has corona. #month5ofmarriage #CoronaVirusUpdate #covid19 #newlywed #StopTheSpread #FightCOVID19,Twitter for iPhone,False,en,985,0
False,1240791809451872259,1029504688939585538,So the queen of social isolation Rapunzel is from the kingdom of............... CORONA! I’m shook! @Disney #covid19 #disney https://t.co/7kTIPKmyYg,Twitter for iPhone,False,en,182,0
False,1240791963886125057,284760236,#coronavirus @maddow @MSignorile HOLY SHIT! Bill Gates predicted the corona virus in 2015. It fell on deaf ears! We need to listen to brilliant minds ! Please rtwt https://t.co/d6lTq0jzd5,Twitter for iPhone,False,en,99860,0
False,1240792087756517377,15495117,Just so you know what the president's focus is on during this life or death emergency. #Coronavirus #CoronavirusOutbreak #CancelTrump https://t.co/WAr0JvOKhc,Twitter for Android,True,en,10209,0
False,1240792119339515904,284760236,@robreiner #coronavirus HOLY SHIT! Bill Gates predicted the corona virus in 2015. It fell on deaf ears! We need to listen to brilliant minds ! Please rtwt https://t.co/GKWnGerI49,Twitter for iPhone,False,en,99860,0
False,1240792135089008640,16795757,"#ContainmentWorks means responsible government implementing #COVID19 Infection Control Protocols, people practicing social distancing, everyone washing hands, and health authorities tracking &amp; tracing all new cases to eliminate community transmissions. Lock down if needed. https://t.co/Uae4Cjs7j5",Twitter Web App,True,en,61135,0
False,1240792149794402304,1213314332051701760,"@WhiteHouse @corona virus sounds less scary #ChineseCoronaVirus gives more information @realDonaldTrump ""finds cure"" for #coronavirus @TheDemocrats say it never happened.",Twitter for Android,False,en,399,0
False,1240792163962716161,1157957028817592320,"After receiving some news about our wedding, I totally agree with my H2B 😥 #coronavirus #plansruined #wheresourhappyeverafter https://t.co/DoanXTgWgR",Twitter for Android,True,en,163,0
False,1240792170568863744,1240332676336410624,Corona Virus Cases in Sweden  📅  Date = 2020-03-20  🤒 Confirmed Cases = 1439  😷 Critical Cases = 21  😢 Deaths = 11  🥳 Recovered = 16    #COVID19 #CoronaSverige #Coronavirus #CoronaSweden,Twitter Web App,False,en,10,1
False,1240792180110786562,14640553,We all know now that the worst enemy of humanity @realDonaldTrump sent a #BlackOps CIA team to Wuhan to spread #Covid19. Now he is trying to fool all with this #ChineseVirus thing. Don't believe the orange clown. #TrumpNotes https://t.co/dK9BHaU5jg,Twitter for Android,True,en,67269,2
False,1240792211635175426,819040267,"@ehundman The Chinese will soon relabel the ##coronavirus as #sacracoronavirus If you don't know what the Sacra Corona Unita is, it's time to refresh your knowledge about Italian organised crime",Twitter for iPhone,False,en,2449,0
False,1240792216588750855,16354958,Songs of the times -   B-B-B-Bye Corona....B-B-B-Bye Corona #coronavirus,Twitter Web App,False,en,4,0
False,1240792237606346752,420797994,Thinking of the #nurses and other #HealthcareHeroes being put @ risk for #COVID19 because of people like this. Thank you for the #sacrifices you have all made to keep everyone else #healthy and #safe #SocialDistancing #InThisTogether https://t.co/TuowRD8oxq,Twitter for iPhone,True,en,883,0
False,1240792336805830656,295635857,"The #Coronavirus did one good thing and this could be a tradition of a ""Positive #CoronaVirusChallenge"", every year around this part of these months (don't know which month when it happen) decorate your house with ""Corona lights"" (that's the name I got right now it...",Twitter for Android,False,en,62,0
False,1240792346813444096,1538718654,"#Coronavirus means how we work, learn, and play will change. Shipments of Digital Video Headsets powered by #MicroOLED panels about to grow fast globally. https://t.co/Lhmd3v7lYv",Twitter for iPhone,True,en,6991,1
True,1240792379445121025,1124717835786313728,"#CORONA: #MEDICAMENT #Chloroquine:Really wise:From #Trump:The nice part is,., its not going to kill anybody,"" #Hydroxychloroquine#Covid_19 #CoronaVirusChallenge#bigpharma #opioid #BAG #Hoax:#statine#HBP #BP#placebo! are better! #swissmedic! https://t.co/KI4KwQnXih",Twitter for Android,False,en,315,0
False,1240792380971745280,398354613,"Stand with @berniesanders and his supporters as we help the most vulnerable affected by the Corona Virus pandemic. Please split a donation between 5 charities helping kids, economically disadvantaged &amp; workers #Bernie2020 #CoronaVirus #Thursday #Bernie https://t.co/RPqRdVvSk5 https://t.co/jkJIJzGzVD",Twitter for iPad,False,en,164162,16
False,1240792394246782978,70916272,#Trending Live corona dashboard takes the existing known #Covid_19  statistics and tries to draw conclusions from them.https://t.co/zF6oyvTPwU#CoronaVirusUpdates #CoronavirusOutbreak  #coronavirus  #CoronaOutBreak #Covid19 #Covid_19 #Covid_19 #COVID2019 #CoronaVirusChallenge https://t.co/vBz6k7IB55,Twitter Web App,False,en,357,1
False,1240792422159921152,963639906,"If you live in #Oxfordshire &amp; are at low-risk, join Students Against Corona to support your local community in self-isolation. Visit •https://t.co/1TSUlhHD6K•https://t.co/KSN0O3FfAufor more info.Sign up here: https://t.co/g1Iq8hDq9V#COVID19UK #Oxford #CoronaVirus https://t.co/qWwTBRtrVl",Twitter for Android,False,en,120467,4
False,1240792425309880322,1235925231316893697,"COVID19 Report(19/03/2020 20:09:00):: Confirmed(&lt;-&gt;)(0): 214910, Recovered(^)(+1755): 84962, Deaths(&lt;-&gt;)(0): 8733, % Died(&lt;-&gt;)(0): 4.06 #Corona #StopCoronaVirus #coronavirus #CoronavirusPandemic #CoronaVirusUpdate #covid19 #COVID2019 #COVID #pandemic #pandemia",covid19_counter,False,en,13,0
False,1240792474811072513,44408466,Does anyone else find it odd that all these NBA players are getting corona ?#coronavirus #CoronaVirusUpdate #CoronaVirusChallenge #China #COVID19ON #COVID19tr #Wuhan,Twitter for iPhone,False,en,7371,0
False,1240792486248878080,71927955,Someone stop me...#corona #coronavirus #parody #imstillhurting #lastfiveyears #jasonrobertbrown #actor #actress #theatre #musical #music #musicaltheatre #singer #theatrelife #musicaltheatrelife #broadway… https://t.co/dbLtERyuBL,Instagram,False,en,2399,0
False,1240792558806224898,312964743,@JackMa @Jackmafoundation Please Help!!!! We need Masks and medical supplies to combat Corona Virus!! @MaimonidesMC in Brooklyn to  #SaveLives &amp; my sons Dad #coronavirus #philanthropy https://t.co/RTVCJASHjv,Twitter Web App,True,en,207,0
False,1240792560672690185,10788222,This is EPIC. Friend who must move her wedding did this It’s the End of the Wedding version of It’s the End of the World  Love you big time @jennpozner #coronavirus #coronawedding Has anyone done a My Sharona - My Corona yet? https://t.co/d5x1AY9xwX,Twitter Web App,True,en,27259,0
False,1240792569430396928,2746141650,This is the remedy I was talking about in the live video tonight. Please click on the link below to listen to Toni’s podcast episode on preventing and treating the corona virus. Thank you 🙏🏼 #coronavirus #CoronaVirusUpdate Listen here ⤵️⤵️⤵️  https://t.co/ZHrSmHvjSH https://t.co/ODGCqGKhuV,Twitter for iPhone,False,en,36541,0
False,1240792613445349381,25852949,"When we have the baby boom in December, please do not name your kids Corona, Corvid, or Nineteen #coronavirus #babyboom https://t.co/hvxW2TslEg",Twitter for iPhone,False,en,11172,0
False,1240792671460962312,2165879130,I STAY AT WORK FOR YOU &amp; YOU STAY AT HOME FOR INDONESIA#covid_19 #covid19indonesia #corona #stayathome #dirumahaja #indonesiaku #tabang #tenggarong #samarindaetam #balikpapan… https://t.co/Xhqx46tzOs,Instagram,False,en,90,0
False,1240792679220498433,43309561,Worried about the effects of #covid19 on your #business?Go to https://t.co/tIuJLkKzH0 for information on: 👉 statutory sick pay👉 corona virus guidance from @acasorguk. #ssp #statutorysickpay #businessadvice #SMEUK https://t.co/xP7WCyLYl8,Sprout Social,False,en,2565,0
False,1240792731456167936,388992294,"Corona Virus getting outta hand,Found out this week that I have Cancer.. and now Two Lakers test positive for Corona.. Dang. #SMH #CoronaVirus #cancer #Lakers",Twitter for Android,False,en,2101,0
False,1240792752939507713,1238275216838705152,https://t.co/tTTBJ4fjFgTHE NUMBER OF ONTARIO RESIDENTS WHO ARE BEING INVESTIGATED FOR CORONA VIRUS IS INCREASING--#Toronto #COVID19ON #Covid_19 #Canada #covid19Canada #coronavirus https://t.co/1byoWG8ys8,Twitter Web App,False,en,0,0
False,1240792755527442434,89372424,Stuck in the house cause of this hoe ass nigga! 😡 Now I’m bored drawing this mane. I guess I’ll name him. King Corona #CoronaVirus https://t.co/lAE2bqTunX,Twitter for iPhone,False,en,239,0
False,1240792798518968322,1237810512169230336,"2/n Pandemics are showing the national character of nations/People:Men: Yeah, but it's controlled!!! (Watch full video by goggling: ""WOW Check it out harry"")Women: My Body, My Choice (Having advantage of A corona-virus gender risk gap)#كورونا #Covid_19 #CoronaVirusUpdate",Twitter Web App,False,en,51,0
False,1240792803816415232,215089454,#CoronaVirusUpdate #coronavirus #CoronaCrisis #coronavirusuk #CoronavirusUSA #usa#ukAll the idiots (panic) (we know we mean idiot / greed) buying.YOU CAN CATCH CORONA VIRUS BY..WATCHING TV... IT COMES STRAIGHT OUT OF THE SET....,Twitter Web App,False,en,4431,1
True,1240792807104811008,67772073,Via @HendrixxBrown ・・・Smh lol#HendrixBrown #PapaTutuTyru #lol#lmao#funny #funnyshit #funnymemes #hilarious #news#media#corona#coronavirus #whitepeople#whitepeoplebelike #BlackMen… https://t.co/xEzL6sKEP0,Instagram,False,en,150,0
False,1240792819419283456,524308359,Corona Virus | Self Isolation | At Risk Immunocompromised people https://t.co/HiRdVflCzE via @YouTube #Convid19uk #Covid_19 #coronavirus,Twitter for iPhone,False,en,3342,0
False,1240792879183867906,4008927135,Coronavirus pandemic will take two years to run its course: German institutehttps://t.co/Tspc0fKhFRhttps://t.co/dESshzSbIy#coronavirus #coronavirusportugal #covid19PT #covid19portugal #chinavirus #chinesevirus,Twitter Web App,False,en,46157,0
False,1240792878651244544,1146073444397780992,@corona That #Corona commercial where a bunch of people stand very close to each other drinking immunocompromising alcohol is a sure way to encourage very dangerous public behavior #coronavirus #sixfeet #SocialDistancing,Twitter for iPhone,False,en,669,0
False,1240793020154421249,1098579025344294912,"The Republicans Corona Virus stimulus is a joke...A one time payment of $1,200, but BILLIONS to bail out industries.Not going to work! I hope the house votes it down!#Stimulus #Check #Trump #CoronaVirus #GOP",Twitter Web App,False,en,16226,0
False,1240793052261658624,126172933,It's strange out there. #corona #virus #CoronavirusUS #covid_19 #covıd19 #viral #pandemic @ Downtown Indianapolis https://t.co/iIsq2RtnzS,Instagram,False,en,100,0
False,1240793092677971968,447388917,Last Call Last Chance Thanks to the Corona Virus #covid_19 ❗❗❗❗❗❗❗❗❗❗❗❗TLC's   Digital Starter Kits are FREE....yes FREE FREE FREE FREE all you have to do is purchase a product and set it to smartship. Which… https://t.co/VhYoKsj1ys,Instagram,False,en,2239,0
False,1240793171669508096,1272800515,"In light of the current health crisis, Free Range Pumpkins has changed their operating hours. #covid19 #freerangepumpkins #arlington #corona #coronavirus #stayathome #doingmypart https://t.co/xA2rhlid8j",Ripl App,False,en,20,0
False,1240793206553542656,2429234756,"In light of the current health crisis, Free Range Pumpkins has changed their operating hours. #covid19 #freerangepumpkins #arlington #corona #coronavirus #stayathome #doingmypart https://t.co/6zXRZMmG5s",Ripl App,False,en,29,0
False,1240793236538634242,2481889842,"In light of the current health crisis, Free Range Pumpkins has changed their operating hours. #covid19 #freerangepumpkins #arlington #corona #coronavirus #stayathome #doingmypart https://t.co/1KQQgYdAy1",Ripl App,False,en,43,0
False,1240793236899278848,605727932,Coronavirus shows the hazard of relying on foreign nations for essentials | Opinion | LifeSite #coronavirus  https://t.co/Sk6g5sGGhj,Twitter for iPad,False,en,23946,1
