sentiment,status_id,user_id,text,source,is_quote,lang,favourites_count,retweet_count
False,1240807461247954945,2946112025,Looks like there’s gonna be a whole lotta this going on for the foreseeable future.  Glad I finally found a simple game that I can play!  #corona #covid_19 #xbox #hometheater #gaming #mancave @ Cool Geekz https://t.co/1ob6MYkwE5,Instagram,False,en,14,0
False,1240807497012670464,18535812,"Everything you need to know about LA's ""safer at home"" emergency order AKA shelter in place, which goes into effect at midnight tonight:https://t.co/mpQlvUOKrN#LosAngeles #ShelterinPlace #Coronavirus #COVID19 #LA #SaferatHome",Twitter Web App,False,en,2259,0
False,1240807545352019969,74562629,"People say ""Hope society changes"" + ""Society learns this"" after dealing with the disaster. Truth is, no, it won't change, it won't learn. How many countless disasters and catastrophes have we faced? And one thing remains consistent... people get worse and worse. #COVID19 #corona",Twitter for Android,False,en,74,0
False,1240807552884961280,88547503,Blunt and direct from this Londoner Lady Panic buyers - business's = greedy f**kers#Auspol #UK #coronavirus #coronavirusaustralia https://t.co/UFUfmT04p7,Twitter Web App,True,en,63063,1
False,1240807564792623106,14764209,Words of wisdom from Mitch Albom about the #CoronaVirus. I think this really is a must read. https://t.co/W29GZL5fUx,TW Blue,False,en,67,0
False,1240807603799646208,2759837716,"Mexico's pres is unfazed by Corona Virus. He seems to be “unfazed” by quite a lot, especially the murder rates of his citizens AND foreigners vacationing in his country #mexico #playadelcarmen #coronavirus #cancun ⁦@USAmbMex⁩ ⁦⁦@POTUS⁩ ⁦ https://t.co/aP2v6tty1G",Twitter for iPhone,False,en,143,0
False,1240807615522918403,1092125799329816578,"We need something like this, but little softer! #coronavirus #corona #korona #hardstyle #rave #music #COVID https://t.co/VmEwH4ciV0",Twitter for iPhone,False,en,535,0
False,1240807629120774144,1109940192838729728,let that sink in. govt is only testing patients who have travel history or have contacted Corona infected. #insane #coronavirus#coronavirusindia https://t.co/YPdhFjlMWa,Twitter for Android,False,en,4968,0
True,1240807664352968705,42235080,I need to win a bet. Drop your best corona virus/quarantine pick up lines! #coronavirus #quarantine,Twitter for iPhone,False,en,554,0
False,1240807741654028289,1060517281,First 'The Simpsons predict Kobe's death...Now Disney's 'Tangled' predicts Corona.Lol...Even the symbol on the flag looks like Coronavirus #CoronavirusOutbreak #RapunzelsTangledAdventure https://t.co/ANqHANXOKf,Twitter for Android,True,en,3,1
False,1240807749098733568,1123079705769340929,NBA All-Corona teamC: Rudy GobertPF: Kevin Durant SF: Christian WoodSG: Donovan MitchellPG: Marcus Smart#Covid_19,Twitter Web App,False,en,25,0
False,1240807793831161857,1085570158993776646,"Got that message ""No work until further notice"" due to Corona #coronavirus https://t.co/kAPY9jkHpJ",Twitter for Android,False,en,820,0
False,1240807800638504960,949199401540448256,Prevent Corona from spreading. Stay hygienic. Stay safe❤️#coronaextra #coronaviruspandemic #corona #coronavirusoutbreak #corvid19 #covid_19 #coronavirus #cough #virus #fight #staysafe #youareblessed https://t.co/eM2OCDR0ll,Instagram,False,en,228,0
False,1240807817600270337,171923685,Jane Goddall about #corona #Covid_19 #coronavirus https://t.co/tJYzz8iHoP,Twitter for Android,False,en,2729,0
False,1240807878639968257,390835154,This is not a drill.. Jays Artisan Pizza is reopening tomorrow for curbside pick up and they have an expanded square pie menu. This is the first good news I’ve heard since this whole Corona nonsense began. I am in tears. There is a light at the end of the tunnel. #coronavirus,Twitter for iPhone,False,en,1222,0
False,1240807898952929280,1581684193,"I wonder if @Sethrogen will spend the Corona virus lockdown with James Franco, Danny McBride, @JonahHill, Jay Baruchel and Craig Robinson like in ""This Is The End"". #coronavirus #CoronavirusUSA #ThisIsTheEnd #CoronavirusLapandemia",Twitter Web App,False,en,5638,0
False,1240807950874263553,298572653,"#coronavirus There are tens of thousands of Chinese living in Prato Italy.  They make designer fashion goods with the label “Made in Italy”. This corona virus situation in Italy cannot be an isolated incident, without considering this Italy China connection.",Twitter for iPhone,False,en,1,0
False,1240807959992598528,887763807480754176,"#coronavirus so the girl in tangled is isolated from the rest of the world, and she lives in a town called corona. Could this be tangled/@Disney predicting 2020. 🤷🏻‍♀️ https://t.co/MtoqGuYH4p",Twitter for iPhone,False,en,91,0
False,1240807967810662402,470330666,What an idiot #BradySluder #CoronavirusOutbreak https://t.co/Dd1NGgZYwI,Twitter for iPhone,True,en,8854,0
False,1240808020189360128,2607751283,"#coronavirus That moment when you realized corona has surpassed 9,000 deaths... https://t.co/Wb2Oa277jJ",Twitter for iPhone,False,en,3036,0
False,1240808019148980226,1239014204037664768,@mattdanaher @RealSaavedra In #Korea we do count that as corona related death because it is. The patient would’ve still had a few months/years or even a decade if it weren’t for #Coronavirus hence you absolutely must in order to be more accurate rather than dismissing it.,Twitter for iPhone,False,en,37,0
False,1240808043123785730,2749907521,Pause for the cause: “2020 Interlude” on all platforms https://t.co/7GqJ0oAAj1 #Corona #coronoavirusoutbreak #coronavirus #nba #Lakers #KobeBryant #PopSmoke #womenofLatinAmerica #Parchmanprisom #Mississippi #Tennessee #tennesseetornado,Twitter Web App,False,en,1198,0
False,1240808093203734530,257741292,These simulations show how to flatten the #coronavirus growth curve https://t.co/cTr1s6mlQo This is a well documented essay on Cronavirus.,Twitter Web Client,False,en,958,0
False,1240808116566065153,1150213717545627648,Just decided to have some fun....https://t.co/rw3lrThUtV #COVID19tr #covid #corona #coronavirus #barbados #bashment #riddim #quarantine,Twitter Web App,False,en,18,1
False,1240808148228886528,345484138,This is what’s sad they are even the ones who will suffer the most but they’ll cause the most damage... and these are the people who procreate.. #coronavirus https://t.co/MLAhlvUMAM,Twitter for iPhone,True,en,574,1
False,1240808260548075520,1187037751088177154,https://t.co/6vmguhjhYi #ChinaCoronaVirus #coronavirus #China  China should focus on help insted of propaganda.,Twitter Web App,False,en,464,1
False,1240808273009229824,35789679,Just went for a drive down the #LasVegas #strip and saw all these people!!!??! #corona #usa #flatenthecurve #coronavirus @ Las Vegas On The Strip https://t.co/8qgmFf5ecK,Instagram,False,en,93,0
False,1240808284132646923,1492642878,You’ve got to read this. This isn’t a joke and neither is COVID-19 (corona virus). #Covid19usa #coronavirus #imperialcollegereport #medicalupdates https://t.co/4FneCQDstO,Twitter for iPhone,True,en,625,0
False,1240808358829002758,262576845,When you undergo through a Thermal Check for #Corona it feels like a person who is checking will shoot you on your forehead. 😜#CoronavirusPandemic #CoronavirusOutbreakindia #coronavirusau #COVID19tr #QuarentineLife #Covid19India #coronavirus #FightCOVID19,Twitter for Android,False,en,414,0
False,1240808362960273409,80281171,"Educated pple r doing these together: panic and carelessness!Blaming our office, govt, RWA for not doing enough; even sloganeering, refusing to work; ,isbehaving with people with suspicious symptoms.But crowding to buy provisions much beyond need.#CoronavirusOutbreak #corona",TweetDeck,False,en,246,0
False,1240808474436685826,38984398,Let’s start a thread: I’m throwing a coronavirus themed birthday party for myself next year. We will: 1. Drink corona beer 2. Play the toilet paper mummy game 3. Dance the Macarena. But change the lyrics to “hey my corona” What am I missing? #CoronavirusPandemic,Twitter for iPhone,False,en,893,0
False,1240808495932264448,841885784068222976,"@mitchellvii The liberal media has been refusing to talk about chloroquine etc, don't forget the PANIC is to tell people there's no treatment except for a ventilator. They don't understand off label &amp; compassionate care usage of drugs until a number of cases are proven #Virus #Corona #Covid19",Twitter Web App,False,en,23136,0
False,1240808551867543558,70438289,A must listen to during this time #COVID19 https://t.co/DG1LMYGSgB,Twitter for iPhone,True,en,2517,0
False,1240808573476769793,561342233,*april 1st rolls around *Everyone quarantining/sick w corona:Media: APRIL FOOLS 🤪 #coronavirus,Twitter for iPhone,False,en,8153,0
False,1240808572126203904,1179679005588500480,Corona is something you shouldn't make fun off. Thousands of people die per day and you stupid ARMY Bitches have nothin better to do than this? What a disgusting fandom I hope you get Corona Maybe @BTS_twt will help you out Oh wait no they don't care shit bout u #EXO #coronavirus https://t.co/2jrgp4HcP1,Twitter for Android,False,en,889,2
False,1240808612781580290,2574200585,"For weeks Fox denied the seriousness of corona virus. An Economist poll found that only 38 percent of Fox News viewers took the virus seriously, half as many as MSNBC &amp; CNN viewers. For Trump’s sake, Fox risked the lives of its own audience. #coronavirushttps://t.co/Fs9r0DpMSS",Twitter for Android,False,en,38610,1
False,1240808621413412872,840496659448643584,It's nice and all y'all Czech people decided to do construction work on your houses during the quarantine. But do you seriously have to do it from 7-8am while I'm trying to get better from bronchitis so I don't die from corona? #Czechia #Czech #Prague #coronavirus,Twitter Web App,False,en,89,0
False,1240808653319548930,716375293,I can’t even get a diagnosis test ran on my car cause of this corona crap.. y’all better send me a check for a new car if it dies 🤦🏽🤦🏽 #coronavirus,Twitter for iPhone,False,en,1018,0
False,1240808737096355841,32911334,Social distancing means trying new drinks like this Lemon Lime Vodka Soda from @nsspiritco #day4 #selfisolation #socialdistancing #corona #covid_19 #vodkasoda #lemonlime #overice #trublood #drinks #kanata #ontario https://t.co/oDWPtAwJRm,Instagram,False,en,6967,0
False,1240808747502534659,2366941820,Whats going on...🙄🙄Corona is everywhere but mosques 🕌 are still empty...🤷🏽‍♂️Koi namazi nahi sirf 2 safhein aaj b...😢😢#CoronavirusOutbreak #COVID,Twitter for iPhone,False,en,869,0
False,1240808792964493312,104099417,What’s wrong with him?? 😡😡😡 is it necessary &amp; help out w/the crisis #COVID19 #COVIDー19 #coronavirus https://t.co/796v8tSdqi,Twitter for iPhone,True,en,5328,2
False,1240808817081884674,996816227103363072,I literally just saw a commercial for Corona beer featuring a group of millennials at a beach party. How have they not rethought their advertising strategy yet? #lostyear2020 #coronavirus #coronabeer #coronavirusvsbeer,Twitter for iPhone,False,en,1286,0
False,1240808872421527556,578730073,I got that Gold On A Roll!!!! Times are tough now a days guys. Can’t wait for this crap to be over already. Stay safe my friends. #corona #coronavirusmemes😂😂😂 #coronaviruspandemic https://t.co/DdtlgezN92,Instagram,False,en,22,0
False,1240808905137098752,3384057167,"""Crown shyness""?! Corona is Latin for crown so these trees have... the corona shyness? #SocialDistancing #CoronaVirusCanada #coronavirus #COVID19ON https://t.co/fMa3SP92bc",Twitter Web App,True,en,247,0
False,1240808921272422401,1144639774235361281,What we should do to avoid Corona virus- Wash hand- Wear Mask- Use Sanitizer- Isolate Yourself- Work From HomeWhat Mr. Modi Suggested- Go to your Balcony &amp; Clap on 22nd March#CoronavirusOutbreak,Twitter for Android,False,en,2304,6
False,1240808935076003841,241659161,Sitting here AT WORK confused why I haven’t walked out because they still have us working and not from home while the rest of the world is on lock down. But at least I’m getting paid if I die from corona #guessicantcomplain #coronapocolypse #covid19 #stayhome #wfh,Twitter for iPhone,False,en,1475,0
False,1240808957284843520,1159641149709201411,@Kris38715722 I've seen twice on TV them telling people you don't even have to go in to dr if you have corona. Just treat it as the flu unless you get really bad. People are hypochondriac morons. #coronavirus #COVID19ON,Twitter for Android,False,en,4095,0
False,1240808985776672768,1156756496320888832,"It's a very important urge to the nation by our respected h'nble PM @narendramodi to do the #JantaCurfew .... I support and request all citizens of our nation to do the same on 22nd March, 2020Let's defeat the #COVID19 together...and make our country #Corona free",Twitter for Android,False,en,845,0
False,1240809003854241792,1141463004254474240,"•Did you catch Tuesday’s (3/17) show?•I discussed the Coronavirus, Government “Bailout”, and “Shelter-In-Place”.•You can watch it here.•Thanks!#sharpeway #larrysharpe #libertarian #liberty #coronavirus #corona #COVID19 #ShelterInPlace #bailouthttps://t.co/6OMOHqtY5L",Twitter for iPhone,False,en,4156,0
False,1240809018999877633,2165879130,You stay at home for INDONESIAandI stay at work for you#melawancorona #melawancoronabersama #melawancorona💪💪💪 #covid_19 #covid19indonesia #corona #stayathome #dirumahaja #indonesiaku… https://t.co/dSFejwMpdZ,Instagram,False,en,90,0
False,1240809017959538688,1159029605421817856,@VishalDadlani Mr. Vishal Dadlani it takes sense to get sensible things in your tiny mind ... If government wasn't aware then Corona rate in country would be in thousands and country would have closed today ..  you just need to open your filthy mind to except these expedient#coronavirus,Twitter for Android,False,en,3244,2
False,1240809023391141888,28047358,If you eat these tortillas you are immune to the corona virus.  #deming #CoronavirusOutbreak https://t.co/6jUxS6sXg8,Twitter for iPhone,False,en,1701,0
False,1240809099903643649,729209180,"For those individuals, businesses or nonprofits that have been impacted financially by Corona virus (COVID-19)...  you can apply for disaster loan assistance in link below.  Stay healthy and safe.  #sba #disasterrelief #covid19 #covid https://t.co/xoPasQz3tE",LinkedIn,False,en,3,0
False,1240809134586580994,560777776,How will I know if I’m carrying and spreading corona if I get turned away from testing?!! We have a RIGHT TO KNOW the REAL NUMBERS!!!!! #coronavirus #covid19 @GovMurphy @NJGov @realDonaldTrump,Twitter for iPhone,False,en,7865,0
False,1240809144644501508,28805729,".@FallonTonight @jimmyfallon @JimmyKimmelLive @6abc @FOX29philly gotta hear this Corona Parody!Bye bye bye bye, Corona https://t.co/mrNyDK20Y2 via @YouTube #byebyebyebyecorona #coronavirus #COVID19ON",Twitter for iPad,False,en,2385,0
False,1240809143847415810,865257074,Just getting started on my corona bucket list..... #coronavirus,Twitter for iPhone,False,en,11967,0
False,1240809219688927237,1017540973562355712,🔴There are rumors spreading so fast that the #Tanzania government plans to postpone the parliament “budget sessions” which supposed to start on 31 March 2020 due to #COVID19🦠 outbreak. If it’s true there will be no general Election 🗳 October 2020 : Let’s be observers 👀 https://t.co/NMM2Yqv1au https://t.co/IwYcApFfGu,Twitter for iPhone,True,en,7844,3
False,1240809235358699520,952772786358861827,"Gavin Newsom says 52% of Californians will be infected with  the corona virus, in an 8 week period.What does that say about hi leadership? ""Loser""#RecallGavinNewsom #CoronaVirusUpdate #coronavirus #COVID19 #CoronaCrisis",Twitter for Android,False,en,43816,0
True,1240809280372191233,41479920,"“Even if we were to lose all events for 2020, it will not be the end of the World Tour.” These are good news. How does the corona virus impact the PWA tour. Read more: https://t.co/LApWkkrvom #pwaworldtour #windsurfing #COVID19",TweetDeck,False,en,1948,0
False,1240809290090381312,1168216655887028224,*LeBron has the Corona VirusMe:#coronavirus https://t.co/J93zsKS49V,Twitter for iPhone,False,en,0,0
False,1240809310499700736,56254987,[Newsmaker] Women's pro basketball season canceled due to coronavirus#COVID19 #Corona #Coronavirus #CoronaVirusUpdate https://t.co/vDZ9eRQyOa,Twitter Web App,False,en,25,0
False,1240809383371722752,1060455529,Fighting #Covid_19 - Japanese way https://t.co/skxL2lNAxE,Twitter for iPhone,True,en,1474,0
False,1240809386022449152,1240808665009045507,The tea has been SPILT 🤭 @WTHRcom @WISH_TV #corona #covid19 #breakingnews #thisjustin #pandemic #coronavirus #CoronavirusOutbreak https://t.co/GzDXfzbAF6,Twitter for iPhone,False,en,0,0
False,1240809402711474176,1240191989817036800,$ACHV Smokers you have a higher risk that  #coronavirus can be severe to you.Day to Day video when you have the Corona Virus https://t.co/jdymd1VqQb,Twitter Web App,False,en,33,0
False,1240809547276505089,187810836,Waiting for Charter/Spectrum to realize that their employees shouldn't be cooped up in a call center!!! #CoronaVirusUpdate #Corona #coronavirus,Twitter for Android,False,en,554,0
False,1240809607217340417,292444797,I fell like inside in resident evil movie#corona#covid19,Twitter for Android,False,en,59,0
False,1240809610459504640,1585667742,Anyone worried about corona virus should really watch this Ted Talk video. I think it can explain and help understand a little better. https://t.co/cIwwOXG9fj @CM320DClass #coronavirus #tedtalk #StaySafe,Twitter for iPhone,False,en,51,0
False,1240809622266576896,1137447558,"One thing for sure, Corona is bringing out our creative genius.  😆#coronavirus https://t.co/vW603WjQ1e",Twitter for iPhone,False,en,111970,57
False,1240809652515770369,55494142,'Transiting' patient tests positive to #coronavirus at drive-through clinic https://t.co/YIHJGoi14k via @WboolStandard https://t.co/sWEUJvgLmq,TweetDeck,False,en,3389,1
False,1240809672472436740,1408428650,Hahahaha this cracked me up 😁😁.#CoronaVirusUpdate #corona #CoronaInPakistan #COVID #COVID2019 #Russia #Pakistan #CoronavirusOutbreak https://t.co/PpOsB7OfyG,Twitter for Android,False,en,12104,1
False,1240809678571024385,1239802409955864577,Who raised you so poorly? #COVID19 #Coronavirus #Florida #SpringBreak https://t.co/dl82dZ83GE,Twitter for iPhone,True,en,0,1
False,1240809728969596931,1133779904284176384,"Quarantine snack box for kids....Kids staying home mean they keep asking to eat, so this is the best way to do it. It is actually working!Also added a cloth napkin cus we are saving paper towels 👍🏼#coronavirus #Corona #QuarentineLife #TraderJoes #NoSchool #COVID19 https://t.co/2FWN9MyYvb",Twitter for iPhone,False,en,8,0
False,1240809742316044290,1179646000975269889,"In US, « according to the World Health Organization, those who do need to go to the ICU can likely expect big bills, regardless of what insurance they have. » #coronavirus #COVID2019 https://t.co/fGKjrERe0T",Twitter for iPhone,False,en,9,0
False,1240809772980420608,46958872,Corona Virus has finally hit close to home. I just found out my sister has it 😥 Please send her good vibes and young people take note; we aren't invincible from this! #CoronaVirusUpdate #COVID19,Twitter for Android,False,en,13094,1
False,1240809878144376837,356613322,What the HELL IS WRONG WITH THEIR FACES?!?!? #morons #coronavirus https://t.co/Mh9vL41CR9,Twitter for Android,True,en,14820,0
False,1240809924629794817,376721174,"•Did you catch Tuesday’s (3/17) show?•Larry discussed the Coronavirus,  Government “Bailout”, and “Shelter-In-Place”.•You can watch it here.•Thanks!#sharpeway #larrysharpe #libertarian #coronavirus #corona #COVID19 #ShelterInPlace #bailouthttps://t.co/mT1wmfc7Z3",Twitter for iPhone,False,en,27624,0
False,1240809985728274432,23397241,@BarackObama check out what law students from MULTIPLE schools have joined together to do - pro bono research for lawyers in need of assistance with cases revolving around #Covid_19 #BeTheChange #UnitedAsOne https://t.co/gxI0UMMeRp,Twitter for iPhone,True,en,52501,0
False,1240810024743473153,25116112,For Los Angeles  - FYI - https://t.co/76j5UzIJFc#CoronaVirusUpdate #coronavirus #LosAngeles,Twitter Web App,False,en,1322,0
False,1240810067479363586,376721174,"•Did you catch Larry’s show tonight (3/19)?•He discussed topics related to the Coronavirus: government giving out cash, restrictions, volunteering, US industry, etc.•Don’t miss it!#sharpeway #larrysharpe #libertarian #coronavirus #Covid_19 #coronahttps://t.co/FmlbJUdcQd",Twitter for iPhone,False,en,27630,0
False,1240810083530965001,220942039,CORONA VIRUS BE LIKE:#Covid_19 #coronavirus #UnitedAsOne #Imagine #CoronavirusOutbreak https://t.co/ZoT97KK3W8,Twitter for Android,False,en,972,0
False,1240810095480647680,1539656882,"«For a moment, nothing happened. Then, after a second or so, nothing continued to happen.»#hitchhikersguidetothegalaxy #corona #coronavirus #quarantine #douglasadams #CoronaReading #isolation #nyhverdag #koronafast #nothinghappens",Twitter for iPhone,False,en,144,0
False,1240810134508646400,89892248,"This is a religious corona person, whether religion and corona are simultaneously identifying their humanity. When the whole world is about to die, he plays with religion and is that his humanity? #covid19 #COVID2019italia #COVID2019france #covid19UK https://t.co/3atx7TmyAs",Twitter Web App,False,en,256,0
False,1240810138899845121,760547158353469440,#Arrivealive #AnigyeKwanso                                        DJayKinino Outro Corona Virus 🦠      Go Away From Mankind. #Covid19 #StayHome &amp; #StaySafe #WashYourhands #NoShakingofhands @ Koforidua https://t.co/w4BDeRrtIu,Instagram,False,en,2520,1
False,1240810191668592641,1129937399822323712,Corona Lockdown Day 5 1 Episode of @TheCloneWars 4 Episodes of The Suite Life of Zach and Cody 1/2 pod of @PardonMyTake #QuarentineLife #CoronaLockdown #StaySafeStayHome #StayAtHomeChallenge #life #JustStayAtHome #COVID19 #CoronaVirusChallenge #justchilling,Twitter for iPhone,False,en,3,0
False,1240810249885540354,16178009,The @MarriottIntl will not cancel a planner event in Anaheim California that will host 1000s of people in April that may cause more cases of #coronavirus @CAgovernor @City_of_Anaheim @CDC_eHealth @GavinNewsom  #CoronavirusPandemic #corona #Covid_19,Twitter for Android,False,en,4453,1
False,1240810295968370698,1373489461,"Hey Corona, stay the hell away from Dr.Nowzaradan! #my600lblife #drnow #TLC #coronavirus",Twitter for iPhone,False,en,1987,0
False,1240810379241852928,552121736,Whoa! #LosAngelesLockdown #COVID19 https://t.co/QmZ21FeqEo,Twitter for iPhone,True,en,62687,0
False,1240810411999592448,196270343,"No music or clapping from the balconies of this part of Casablanca, but only Quran.Heart warming to see this, Sheikh Yasser Al Dossari taking over this street with his beautiful way of reciting.HAMDOULILAH FOR THE NI3MA OF ISLAM..❤️🥺#Casablanca #COVID19 #Islam #Corona https://t.co/xFH5gTh5g4",Twitter for iPhone,False,en,1525,25
False,1240810427954499586,22702661,"#Hope. First #orchid #spike in almost four years. #covid19 #corona #shelterinplace @ San Francisco, California https://t.co/WN8XiYibQL",Instagram,False,en,12925,0
False,1240810442303430657,42325862,"Here r some real winners. If I get corona, I get corona? #Closefloridabeaches #FlattenTheCurve #Covid_19https://t.co/UXpc9TSvJ3",Twitter for Android,False,en,4736,0
False,1240810477577519111,156295596,Communist China is the new world terrorist. breeder and disseminator of pests such as the corona virus. @realDonaldTrump @jairbolsonaro #coronavirus,Twitter for Android,False,en,4382,0
False,1240810523983319047,108702694,Mark my words there will be a new legislation for our protection similar to the Patriot Act but in the realm of healthcare that will give government a lot more power. Corona new world order !!! #CoronavirusOutbreak #CoronaVirusChallenge #coronavirus,Twitter for iPhone,False,en,1071,0
False,1240810538592014337,143254257,#Rona got ppl outchea going crazy over paper products 🤦🏾‍♂️ #Corona #Coronavirus #Pandemic #ToiletPaper #fight #lol #laughing #lmao #rotfl @ Winn-Dixie https://t.co/FtZTBSZLKV,Instagram,False,en,198,0
False,1240810555008401408,2946792636,"Clearly, none of them are thinking about the risks they now pose to their own parents or grandparents or aunties or siblings or neighbors or ... Meanwhile, in the Fontaine homeMe: DON’T even think about going to the bar.18 year old son: I’m not stupid mom!#COVID19 https://t.co/XbddIY6xAN",Twitter for iPad,True,en,9776,0
False,1240810615112896512,996450200284737537,"Since corona is big and everyone thinks trump is great. U.S sanctions has stopped foreign aid for Iranians. More then a 1,000 people have died and the medi is not covering the story. Retweet to help humanity #fucktrump #coronavirus #Covid_19 https://t.co/9ngBVSahiB",Twitter for iPhone,False,en,2006,0
False,1240810613917519872,710647717295357957,Do your part to help protect the 🌎 . Wash 👏🏽 your  👏🏽 hands 🤚🏽!  Stay inside &amp; get well 💕#lettering #ipadart #papercrafts #art #ipadpro #apple #corona #coronavirus #news #thursday #procreate #quarantineandchill 🦠 @… https://t.co/dz93X0510n,Instagram,False,en,4090,0
True,1240810629209952256,757313851889098752,@caseydband covering 3am in the Casey Donahew Corona Happy Hour  is the highlight of today’s quarantine experience #Covid_19,Twitter for iPhone,False,en,1743,0
