sentiment,status_id,user_id,text,source,is_quote,lang,favourites_count,retweet_count
False,1240841954927218690,578287780,Me and my 3 friends during this quarantine. #coronavirus #corona #coronamemes #SpongeBob https://t.co/uxyqjd4tev,Twitter for iPhone,False,en,24308,0
False,1240841977798615047,884679521680502786,"Now the outbreak of corona virus is more severe, people stay at home for a long time. Our creator Gavin has not forgotten his work and is still thinking about how to make the most of our Swift800. Thank you very much for his efforts. #coronavirus #swift800 #cvw https://t.co/VOpwz9jjt3",Twitter Web App,False,en,111,0
False,1240842052226727937,245175299,Credit card travel points suddenly feel like a fairly worthless perk #COVID19 #Finance #Corona,Twitter for iPhone,False,en,30,0
False,1240842063345844224,17061280,"He replied, ""You of little faith, why are you so afraid?"" Then he got up and rebuked the winds and the waves, and it was completely calm. Matthew 8:26  My dear Christian friends, you won’t be taken to the glorious heavens until it’s His timing. #COVID19 #CoronaVirusUpdate #Corona https://t.co/tTfquIGHES",Twitter for iPhone,False,en,20296,0
False,1240842103120429057,504980865,You are our heroes: thank you!🚑🇪🇺Thank you to our heroes.#eudebates #coronavirusitalla #Covid_19 #coronavirus #CoronavirusOutbreak #Corona #COVD19 #Health #COVID2019italia #COVID #heroes #ItalyCoronavirus #Italia #italystaystrong #Italie #italylockdown #Italy #italylockdown https://t.co/tFa5u383y4,Twitter Web App,False,en,501,0
False,1240842161173733376,894240626115588096,"I want to deliver a message to the world. We are at war with an enemy that we cannot see, but we know of its existence, but I believe that we can defeat this enemy by taking all possible protection against it and preventing its spread. #Covid_19 #Corona",Twitter for iPhone,False,en,766,0
False,1240842180232482817,327975594,"@CollectorKota @ashokgehlot51 ji implemented 144 in the state, cancel all exams bt school staff is still going on jobsif u understand tht the private school staff r hundreds in numbers. Plz think abt these people's health n order relief thm 2 attend institutes#Covid_19#corona",Twitter for Android,False,en,8598,0
False,1240842188755365888,824300419413405696,Stay PositiveStay ProtectedFight Corona Virus#CoronaVirus #coronavirusindia #JantaCurfew https://t.co/8OQi3OVlF3,Twitter for Android,False,en,29,0
True,1240842188310941698,876980715929391104,It's part 3 of our #coronavirus investing special. Discussing @Qantas Airways on The Intelligent Investing Podcast w/ @puppyeh1 &amp; @EricSchleien #investing #valueinvesting #CoronaVirusUpdate https://t.co/TeCeR73J4t,Twitter Web App,False,en,24,0
False,1240842205801005056,335940023,#CoronaVirusUpdate#coronavirusindia#coronavirus#Corona C- Clean Your Hands ✋O- Off From GatheringsR- Raise Your Immunity 😇O- Only sick to wear mask 😷N- No To Shake Hand🙏A- Avoid Rumours 🚫,Twitter for Android,False,en,25,3
False,1240842234318041088,996573679612903425,"Once a racist, always a racist. Trump will NEVER change xenophobic ways. @realDonaldTrump #CoronaVirus #TrumpIsTheWORSTPresidentEVER https://t.co/Nu9VUFF6WC",Twitter for iPhone,True,en,49974,2
True,1240842268388573195,970757352742903809,It's part 3 of our #coronavirus investing special. Discussing @Qantas Airways on The Intelligent Investing Podcast @investingcast  w/ @puppyeh1 &amp; @EricSchleien #investing #valueinvesting #CoronaVirusUpdate https://t.co/4AKlC2EOBx,Twitter Web App,False,en,1984,0
False,1240842276668149760,64377034,"Stay inside for a week ,follow all the precautions suggested by government because till now we humans are not smarter than Corona virus. #covid_19 #corona #india #catsofinstagram #kittenplay #kittenlove #catstagram… https://t.co/lHKX6U1uXg",Instagram,False,en,376,0
False,1240842334792642565,937295801780379655,Our team have taken measures to ensure we’re here to make through COVID-19. We may be working remotely but we’re still providing all our services across creative and production. Keep safe everyone!#covid_19 #corona #coronavirus #creative #production #marketing #digitalmarketing https://t.co/B2OOtMNV0l,Twitter for iPhone,False,en,656,0
False,1240842347237212166,33639486,@chrisrock saved us all from #COVID19 #COVID19ON #CoronaVirusUpdate #Corona https://t.co/jRZdWYtprg,Twitter for Android,False,en,356,0
False,1240842343890157568,187796215,#Spies adapt their tradecraft to the #CoronavirusOutbreak. #espionage https://t.co/o9bUxHRqpJ,Twitter for Android,False,en,232198,8
False,1240842355554516993,17965161,#Coronavirus prevention in #Brazil forgets favela residents #inequality https://t.co/kIkr0b8u9p,Twitter for iPhone,True,en,4371,0
False,1240842407354290176,1237559412593655809,When you realize your dog’s toy eerily looks like the corona virus. Git it Bella! #coronameme #coronavirus #covid19 https://t.co/mE4dsIeV1d,Twitter for iPhone,False,en,1,1
False,1240842426434158592,1137854648117858304,Class of 2020: *mad that our senior year is ruined*The corona virus:#CoronaVirus https://t.co/7FBqlT1taQ,Twitter for iPhone,False,en,0,0
False,1240842457031434241,1130724787590844417,Another of My Corona Virus Diaries: https://t.co/8p4l53p5LB  A look at friends around the world and what they are going through. Stay safe. Shelter in place. Wash your hands. #coronavirus #Covid_19 #covid19 #colombia #california #virus #infection #people #recommended #global https://t.co/kdGU9Tnewo,Twitter Web App,False,en,8882,0
False,1240842464598151168,30674107,"I overslept and it was all down hill from there... I woke up late, and then this moron interrupted the view to give updates on corona. Which further put me in a bad mood... #Quarantine Day 7 #coronavirus #cabinfever 😩😩😩😩😩😩😩😩😩😩😩😩😩😤😤😤😤😤😤😤😤😤😤😤😤😤",Twitter for iPhone,False,en,277,1
False,1240842512195039232,381579417,"""Faith is not enough for a person to be saved.” (1 Corinthians 13:1-3)Go wash your 🧼 hands 🙏🙏🙏 #covid19 #corona #prayerworks https://t.co/qcAzZoqD6q",Twitter for iPhone,False,en,99541,0
False,1240842527252586497,812353185906118657,"When Yuh reach heaven and God find out yuh been coughing to escape tickets, school, assignments or work in general, talking bout you got corona #CoronaVirus https://t.co/loAnzbxdqd",Twitter for iPhone,True,en,5337,0
False,1240842536190541825,1153911657019502592,We either enjoy or suffer the actions or reactions of our 'Karma'. Our Karma should be such that our future generations enjoy and not suffer the results of our Karma.#covid #covid_19 #covıd19 #coronavirus #corona #coronavírus #karma #selfcontrol #selfhelp #selfgrowth #psychology https://t.co/bWi9HoUj4n,Twitter for Android,False,en,0,0
False,1240842610576510981,219864588,#JanataCurfewMarch22 What will be result?As #Covid_19 virus life at one place is 12 hrs and curfew is for 14 hrs so the places or points of public areas were #corona may live will not be touched for 14 hrs will break the chain.What we get after 14 hrs will be a safe country.,Twitter for Android,False,en,13322,1
False,1240842648815988736,75198812,#COVID19: Government created WhatsApp Chatbot on #CoronaVirus. It is called MyGov Corona Helpdesk.Save on WhatsApp 9013151515 and you will get automated response on queries related to Corona-National Pharmaceutical Pricing Authority https://t.co/x4GZc2tWA0,Twitter Web App,False,en,4766,0
False,1240842657628291073,163476037,"So we in Pakistan are so so scared of #Corona #Covid_19 that we have almost forgotten that our republic day is just 3 days away. No talk, no celebration, no recognition even. Tough times#23March #PakistanFightsCorona #CoronaInPakistan",Twitter for iPhone,False,en,2331,0
False,1240842713517510656,73857855,"Two new #COVID19 cases registered in #Herat during past 24 hours. Both infected are returned from #Iran. @mophofficial say, with registration of new cases, total number of positive #corona cases is now 24 in over all #Afghanistan.",Twitter for iPhone,False,en,351,1
False,1240842713005731841,1176544139615318016,"The shame of #millenials - killing grand-parents.Simple solution. Ring your own families’ selfish millennial and tell them that if they’re out with friends, then THEY’RE OUT OF THE WILL - let’s see how they afford a fucking house after that!! Lol 😎#CoronaVirus #Springbreak https://t.co/w4GnubPVcI",Twitter for iPhone,True,en,657,0
False,1240842735025885185,1237090409303740422,Such a coincidence that Space Jam 2 is being filmed during this Corona Virus pandemic...#DejaVu #CoronaVirusUpdate #isawthisbefore #lebronjames #nba #COVID19 #StaySafeStayHome #stayconnected #FightCOVID19 #kawhiit #KobeBryant #,Twitter for Android,False,en,1,0
False,1240842745209479170,1113315800788529153,"Y’all, here me on out. What if the corona is the beginning of WW3? #coronavirus",Twitter for iPhone,False,en,1762,0
False,1240842750758551552,1206516150768558080,Get response for queries related to #Coronavirus on MyGov Corona Helpdesk #WhatsApp number 9013151515#CoronaVirusUpdate #IndiaFightsCorona #UnityLiVEs #jitender7k #StayAtHomeChallenge #nirbhayabetraye #China #COVID2019india #PMModi #JantaCurfew https://t.co/NXdvrKHSz1,Twitter for Android,False,en,978,2
False,1240842757305970689,3255786606,#COVID19 Expert Reality Check https://t.co/K2OThYFee5,Twitter for iPhone,False,en,1256,0
False,1240842846183272448,1053028469280522240,Supervising all the telework going down.... ......#catstagram #cats #cat#catsofinstagram #condocatlife #condocat #fireatthecondo #kitty#kiteh#corona #coronavirus https://t.co/34oCspG5k8 https://t.co/fCrMcA75pJ,IFTTT,False,en,0,0
False,1240842915045421058,1239607640952619009,@NBCPhiladelphia unless that flame can cure the corona virus don’t even bother sparking that shit #CoronaVirusUpdate #coronavirus #COVID19,Twitter for iPhone,False,en,203,0
False,1240842945483464704,1232144105683087360,https://t.co/MBrJM0MO9A ya'll are worth almost a million dollars and you are out here acting like you are starving and won't be the first in line when the Corona cure #CoronavirusOutbreak #unawarecelebraties,Twitter Web App,False,en,7,0
True,1240842949518295040,1148491804498509825,Auto-Sensing Hand Sanitizier &amp; Soap Dispenser Best Defense Against Corona Virus #coronavirus #HandSanitizier #HomemartOnline #AntiCoronaVirus visit our website: https://t.co/wmsc8DbIRMwhatsapp: +86 136 7293 6908 https://t.co/wULbj6emY6,Twitter Web App,False,en,5,0
False,1240842961983766528,241740506,Anti CORONA Unisex Hoodie - STAY SAFE WASH YOUR HANDS Pullover - Multi Colors available #washyourhands #HandsWashing #Hands  #hoodies  #hands_washing  #COVID_19  #Coronavirus  #Corona  #virus #clean #hands  #AntiCorona #Unisex #sweatshirt https://t.co/etoTUWIYw8,Twitter Web Client,False,en,5,0
False,1240842968736632832,2591675300,".@Kohls, @TJMaxx temporarily closing all stores nationwide to avoid coronavirus spread #COVID19  https://t.co/Z6C9TkAx9K",Twitter for iPhone,False,en,892,0
True,1240843012772634624,1078738712077443072,Meat kills!!! Go Vegan!#Corona#CoronaCrisis#coronavirus#ClimateChange#ClimateEmergency#ClimateStrike#CoronaVirusUpdate#ClimateStrikeOnline@GretaThunberg@peta @PETADeutschlandhttps://t.co/p5xIH8TkE2Len Goldberg!! Greatest Animal Activist!!! https://t.co/PT1AmNdu80,Twitter for Android,False,en,320,0
True,1240843017163902976,625761366,Lights 4 Life...#lights4life.... Just trying to bring some happiness with all the uncertainty going on around the world 💡💗🧬 #sandiego #California #corona #coronaviruspandemic #happiness #covid_19 #positivevibes #sharethelove https://t.co/XU8UpgSvcZ,Twitter for iPhone,False,en,1692,0
False,1240843018627944448,908637544484450310,#Healthyhotipoftheday - Healthyho References:https://t.co/kmaL7UrUzW #Coronavirus #COVID-19 #CORONA #disease #transferabledisease #bacteria #infection #virus #healthyho #HealthyHo #Healthyadvice #Healthyfacts https://t.co/4WsWq81zZy,Buffer,False,en,21,0
True,1240843044200595465,859398522113806336,"In our battle against #COVID19, there is no need to panic; all we need to do is to take effective precautions. #IndiaFightsCorona#Corona https://t.co/RhuvqKKRFJ",Buffer,False,en,79,0
False,1240843082586710016,809643387158720514,"On the other continent, many stupid young undergrads still regard COVID-19 as “just some sort of cold”, even holding parties during spring breaks or after courses went online. “If I got corona then I got corona” as if COVID-19 were not contagious. #CoronaVirus",Twitter for iPhone,False,en,192,0
False,1240843113444151296,807951707464343553,"@dreamgirlhema StaySafeStayHome StayAtHome #JanataCurfew I support #JanataCurfewMarch22protect your community from #coronavirus Wash your hands frequently with soap and water for at least 20 seconds even if they visibly appear clean.हाथ साफ, Corona साफ #IndiaFightsCorona https://t.co/DcE8UbZI8D",Twitter for Android,False,en,106595,0
False,1240843149599260673,444839427,#corona #stockup #quarantine #home #workfromhome #staysafe #positive #indiafightscorona #coronavirus #novelcorona #covid_19 My junior helping mom stock up 🍊🍋🍆🥥🍞🧀🧂Don't miss the… https://t.co/gYGKfGMAIN,Instagram,False,en,7382,0
False,1240843170348445700,1098846170632413184,CORONAC - Clean Your Hands 🖐️O- Off From Gatherings 🏃R- Raise Your Immunity 😇O- Only Sick to Wear Mask 😷N - No to Hand Shake 👏A- Avoid Rumours🚫#CoronaVirusUpdate#StayAtHomeChallenge#Covid_19 #StaySafeStayHome #Italy #CoronaInPakistan #coronaviruspak #Quarantine,Twitter for Android,False,en,1,0
False,1240843268650225664,20908378,Last updated: 2020-03-20 03:05:02+00:00GMT  Coronavirus [COVID-19]    Cases: 245648    Deaths: 10050#corona #coronavirus #COVID19 https://t.co/F6St0S5XHa,rate_twitte,False,en,27,0
True,1240843272353984517,847136124363403264,Just Dropped My Corona Virus Song 💚💚 Love Y’all ! Stay Healthy https://t.co/FRAFqtxV5m #CoronaVirusUpdate #LosAngelesLockdown #StayAtHomeChallenge #BeatTheVirus #BeSafe #coronavirus #CoronaVirusChallenge #COVID19US #coronamemes https://t.co/QqjaeRcTfu,Twitter for iPhone,False,en,160,1
False,1240843353044013057,901766250422042624,Help scientists research the Corona virus. While you're asleep let your rig spend the processing power for it.With the application @BOINCprojects you can participate in the program @RosettaAtHome .#COVID19 #razer #gaming #BOINC #StayAtHome #razermask@minliangtan @Razer https://t.co/g0f65P1f59,Twitter for Android,False,en,441,0
False,1240843359398367232,2217103566,Donate Blood#blood #donate #blooddonation #donation #shortage #bloodshortage #corona #coronavirus #covid19 #CoronavirusOutbreak #srilanka #lanka #lka https://t.co/XWonyQNVw5,Twitter for iPhone,True,en,5106,2
False,1240843416587636736,1167831344581419013,WHAT THE FUCK IS GOING ON CORONA VIRUS #corona #CoronaVirusUpdate #coronavirus https://t.co/lvmkBJ5b96,Twitter for Android,False,en,6799,0
False,1240843582770163712,241740506,Anti Corona Unisex T-Shirt - Stay safe Wash your hands tshirt - Free Worldwide Shipping #washyourhands #HandsWashing #tees  #hands_washing  #COVID_19  #Coronavirus  #Coronavirus #Corona  #virus #clean #hands  #AntiCorona #Unisex #tshirt #tshirts #t_shirt  https://t.co/XtRZs7d7NR,Twitter Web Client,False,en,5,0
False,1240843658884071426,75524873,"Hello sir @RameshPV2010, Do we have any official government channels from A.P who are regularly updating and communicating on social media regarding #Covid19? @AndhraPradeshCM https://t.co/PWmT8MuP4h",Twitter for Android,True,en,7153,0
False,1240843735513960449,15708077,3 day Growth of #Corona Infections &amp; Deaths (16. &amp; 19.03.)#Italy: 47% &amp; 58%#Germany: 111% &amp; 159%#Spain: 82% &amp; 143%#UK: 113% &amp; 164%#USA: 198% &amp; 144%USA &amp; UK with strongest growth of infections (USA) and deaths (UK). https://t.co/8kUWkImhJo#Coronavirus #Statistics https://t.co/xXvlFjZG31,Twitter for Android,False,en,31434,0
False,1240843757580238848,17650854,"As the #coronavirus pandemic spreads, guidance on how to wash your hands intensifies. These recommendations are important, but they are hardly of value to the 40% of humanity lacking access to soap and water, writes Vladimir Smakhtin, head of @UNUINWEH https://t.co/OSjzRk95hA https://t.co/jyHu2WqhKK",TweetDeck,False,en,6526,0
False,1240843798915186688,318244027,What Taiwan Could Teach the World About Handling Coronavirus! A great Story on why China's next door neighbor has only 100 cases!  https://t.co/zpxwJRqvQB   #CoronaVirusUpdate #COVID19 #covid19canada,Twitter for Android,False,en,3303,1
False,1240843848965816320,905916039992549377,This Corona virus is God's reflecting his anger on ya'll... Turn from your wicked ways. Oh ye wicked ones and turn a new leaf. We'll overcome this virus only by that and then guess what even paracetamol medicine will eliminate the virus from the body. #coronavirus #COVID,Twitter for Android,False,en,2249,0
False,1240843892049596416,1071966656904126464,Jauhi corona dekati saya. Please stay safe ye korang. Take care of your health. #PerintahKawalanPergerakan #COVID19,Twitter for Mac,False,en,180,0
False,1240843933661396992,734050961820291072,I was the clown that thought the corona virus wasn’t a big deal when the news first started talking about it🤡🤡🤡  So on behalf of everyone I’m willing to get the virus. #coronavirus,Twitter for iPhone,False,en,22759,0
False,1240843980918501378,2371236272,These simulations show why social distancing etc is crucial (why they should #ShutTheSchoolsNow &amp; force businesses to make staff #WorkFromHomeNow @ScottMorrisonMP @LiberalAus) &amp; why being *FAST in response* is critical #Covid_19WATCH the simulations👇👇 https://t.co/fU7RS3N1Pt,Twitter for iPhone,False,en,28019,3
False,1240844040343416832,43320598,Get response for queries related to #Coronavirus on MyGov Corona Helpdesk #WhatsApp number 9013151515#CoronaVirusUpdate #IndiaFightsCorona https://t.co/5woGZZZg7W,Instagram,False,en,23,0
False,1240844066654269440,29833442,#COVID19 #Love / Landlord waives rent to help restaurants https://t.co/FtHJrl6wZs,Twitter Web Client,False,en,5966,0
False,1240844066646110208,858773184056655872,Hey like this if you don't have the corona virus😂😂 💯💯💯 but all jokes a side im praying for the people who are affected or know someone who is 😇😇😚😚 #coronavirus #COVID19,Twitter Web App,False,en,1425,0
False,1240844085931331585,779264805446094848,#filmtwitter hit me with some film titles with a saucy little #coronavirus #quarantine twist. I’ll go first. I present to you: Love in the Time of Corona https://t.co/qz2O6t2TSi,Twitter for iPhone,False,en,2938,0
False,1240844101290831872,840879909958373376,Corona Pandemic (#Covid19)“Nothing will happen to us except what #Allah has decreed for us: He is our protector”: and on Allah let the #Believers put their trust.”(Al Quran 9:51),Twitter Web App,False,en,5,0
False,1240844102767243265,1065522688624480261,#Madurai Meenakshi Amman Temple to be closed till 31st March due to corona scare..!#CoronavirusOutbreak #coronavirusindia,Twitter for Android,False,en,787,5
False,1240844136829329408,1240520245711974400,This break for the corona virus is making me realize I actually somewhat miss school 😅😂 #CoronaVirus,Twitter for iPhone,False,en,14,0
False,1240844156714414080,2964852844,I like to watch commercials because they remind me of how we used to be pre-corona #coronavirus,Twitter for iPhone,False,en,129,0
False,1240844166839615488,1034685728494473216,If u hv any symptoms of #COVID u need to get urself checked especially if u hv travel history of visiting countries in incubation period of 14 days which is very imp. to monitor urself. #covidindia #Covid_19  #Corona #StayAtHomeChallenge #StaySafeStayHome #StaySafe #stayconnected,Twitter for iPhone,False,en,510,0
True,1240844247667896321,909459121027530752,"#Happy #International #World #Happiness #DayIf You Have The Power To Make Someone  Happy,Do It!The World Needs The More Of That Now☺Don't Go Beyond The Rumors Of Corona, Forget n Be Happy, Make Others Happy:)#Covid_19#coronavirusindia#CoronaVirusUpdate#worldhappinessday https://t.co/bbYTuej4HO",Twitter for Android,False,en,80,0
False,1240844311652073473,4349350992,Miss corona said some “I can show you the world” bitch *same tempo* “get your ass back to China” #coronavirus #COVID19 hey it’s okay to cope with humor. I don’t mean this to be rude 💗😂,Twitter for iPhone,False,en,2536,0
False,1240844338310967296,1897660434,Musicians and artists come up with innovative songs about #coronavirus https://t.co/q0ps1SLhB1,Twitter for Android,False,en,630,1
False,1240844352668090369,62464090,"#hazardOn March 19, government announced 82 new cases of #Covid19, its biggest daily rise, bringing the total number of confirmed patients in the country to 309. 25 have died, the highest in Southeast Asia, while 15 have been declared cured. https://t.co/1ab6UIDr6Q",Twitter Web App,False,en,1102,0
False,1240844431663611907,2255269771,This corona thing is brilliant for swapping deep healing tips.Met a friend yesterday who's into Katie Byron's work and I reckon I can now utilise her method for further healing. While I could give my friend reference for more body focused methods. ☺️#teamwork #healing #covid19,Twitter for iPhone,False,en,7400,0
False,1240844439481917441,378809160,"""@CBSNews: “If I get corona, I get corona. At the end of the day, I'm not gonna let it stop me from partying”: Spring breakers are still flocking to Miami, despite coronavirus warnings. #COVID19 #CoronaVirusUpdate  https://t.co/ROUkEOAZFr",Twitter for Android,False,en,14288,7
False,1240844443034386432,4907165731,What is assurance of killing the COVID-19 virus with 70% ethanol ? Are the sanitizer available in the markets able to kill those viruses which commonly contains (60-65%ethanol) ?  @WHO @corona #corona #safety #covid19  #covid19nepal #sanitizers,Twitter Web App,False,en,2141,1
False,1240844448789082114,1069570782051921923,We are working for U... U stay home for Us...Let's fight with Corona together but separately...@subodhbhave@diBhagyashri#sbiyono #StateBankofIndia #socialdistancing #wethebankers#coronavirus#JantaCurfew,Twitter for Android,False,en,654,0
False,1240844476144287744,3692472494,Social distancing is the need of our society.  It’s a tough call but we need to make it. This is time to sacrifice our social life and prioritize for public safety.  Stay indoors as much as you can. #socialdistancing #corona #precautions #covid_19 https://t.co/3uCn772QoK,Twitter for Android,False,en,211,0
False,1240844486198079489,1079243960827154433,Some false rumors about corona virus #Covid_19 #CoronaVirusUpdate https://t.co/wrd8eoz4K5,Twitter for iPhone,False,en,1759,0
False,1240844489335492610,40079701,#COVID19: Government created WhatsApp Chatbot on #CoronaVirus. It is called MyGov Corona Helpdesk▪️Just save on WhatsApp 9013151515 and you will get automated response on queries related to Corona-National Pharmaceutical Pricing Authority#CoronaVirusUpdate #IndiaFightsCorona https://t.co/Mgd0WgYhdD,Twitter for Android,False,en,405,0
False,1240844517470683142,62464090,"#hazardOn March 19, #President Jokowi instructed #Covid19 rapid test and to expand test coverage. https://t.co/WcJ3Yx0PmV",Twitter Web App,False,en,1102,0
False,1240844527876722688,2339203262,"""Safer at Home"" or ""Stay at Home"" is NOT a lockdown. If you need clarification on what it means, check out https://t.co/4ELsWfZ0Sa - If you are still confused or need clarification, message me. I WILL HELP YOU. #Coronavirus",Twitter Web App,False,en,4458,13
False,1240844524362088450,1435815355,This is how I feel about the GOP’s so called “Corona Checks”#whataboutussmallbusinesses #Coronavirus https://t.co/SjNAS9Tv3D,Twitter for iPhone,False,en,79,0
False,1240844572982276097,62464090,"#hazardOn March 19, #President Jokowi instructed incentives for medical personnel who treat #Covid19 patients. https://t.co/vqrYcblhZA",Twitter Web App,False,en,1102,0
False,1240844577411444736,410628582,"Corona Terminator, working day in and day out with his team in battle against #Coronavirusoutbreak @rajeshtope11 ,whose mother is under treatment in ICU Bombay Hospital, deserve all kudos and accolades 🙏🙏🙏🌹🌹 https://t.co/74SeLHs93j",Twitter for Android,False,en,36395,0
False,1240844610957500419,107950073,#Total Corona virus cases in India-195Total number of Active COVID 2019 cases across India :171Total number of Discharged/Cured COVID 2019 cases across India :19Total number of Migrated COVID19 Patient :1Total number of Deaths due to #COVID19 across India : 4 @MoHFW_INDIA,Twitter for Android,False,en,11626,0
False,1240844625629200386,62464090,"#hazardOn March 19, #BNPB Chairman said #CoordinatingMinisterforPoliticsLawandSecurity suggested there should be sanctions for lawbreakers related to #Covid19 rules. https://t.co/cb4ACot3E7",Twitter Web App,False,en,1102,0
False,1240844764121047040,1057148786189824000,Italy's death toll from coronavirus is so high that obituaries fill over 10 pages of newspaper..... || #Italy #Coronavirus #COVID2019 #COVID19 #CoronaVirusitaly #CoronavirusOutbreak #COVID  #CoronaVirusUpdates #Corona #COVIDー19 #COVID_19 https://t.co/n26VP01VXW,TweetDeck,False,en,4094,1
False,1240844784727621632,303566106,Get response for queries related to #Coronavirus on MyGov Corona Helpdesk #WhatsApp number 9013151515#CoronaVirusUpdate #IndiaFightsCorona https://t.co/OrajCR49rD,Twitter for Android,False,en,3889,0
