sentiment,status_id,user_id,text,source,is_quote,lang,favourites_count,retweet_count
False,1240825283743186945,38530568,"3 things will bring down the US- Greed (Often mistakenly referred to as capitalism)- Going against the wind (contrarianism, misinformation, arrogance, pride and narcissism)- Guns#corona #COVID19 #USA",Twitter for iPhone,False,en,3329,0
False,1240825299727769603,1121969768238583808,Firmware update will be shooted earlier next weekVersion: Corona 2.0#COVID #COVID19ON #Covid_19 #StaySafeStayHome #TogetherWeCan,Twitter for Android,False,en,14756,0
False,1240825308434944001,369476117,#Coronavirus: I filed a story on it on 17th March.  Read 👇 https://t.co/smoWeiccBm https://t.co/KuRGiw85hL,Twitter for iPhone,True,en,5673,1
False,1240825326013272065,3115869229,What are your expectations for life #pcv (post corona virus) #coronavirus,Twitter Web App,False,en,11,0
False,1240825407617843205,532385570,"Tomorrow a new episode of the #podcast &amp; #youtube I'll have a surprise guest &amp; we'll chat about the topic of Corona VirusIT will be pretty chill, fun &amp; informative&amp; Im excited to share it w/ U!#podcasts #youtuber #coronapocolypse #coronavirus #COVID #ChinaCoronaVirus https://t.co/jfGF5ixnvw",Twitter Web App,False,en,5605,0
False,1240825421278728193,809384064956452864,"From today till 31st March, Malls, Gardens, Weekly Haats to remain closed in Surat. I request people to avoid Shopping Markets and Hotels for safe health of all. Take care of elderly people and other needy people at home.#coronavirusindia #Corona #COVID #Covid_19 #Surat #mysurat",Twitter for Android,False,en,295,82
False,1240825434339770373,12754772,"Thanks to my fellow Geek Buddy @mktoon for passing this along as a reference for those of us in California who got this Stay at Home order tonight. If you live here and have any questions about what you can or can't do, click below to find out. #Coronavirus #StayAtHome https://t.co/0Xq2f91O6B",Twitter Web App,True,en,81392,1
False,1240825461728477184,2972017366,"“Corona Crazy” - From SF to Puerto Rico! Special Guests TJ Harlow, David Fuentes &amp; DJ George Jett""  My latest #podcast.  #CoronavirusOutbreak https://t.co/ZH0z1JN7ec",Twitter for iPhone,False,en,2328,0
False,1240825468875608071,1115264153273241600,Going shopping for toilet paper with my son.#oap #podcaster #podcasts #podcast #podcasting #podcastlife #oppositesattract #oppositesattractpod #oppositeattractpodcast #coronavirus #covid_19 #corona #virus #quarantine #together #family #familyfirst #familytime #bebrave https://t.co/69Bp22FpiV,Twitter for Android,False,en,18,0
False,1240825513784029186,116295335,Effect... more stupid and dangerous people #Covid_19 #springbreak2020 https://t.co/4K1LbrrJX4,Twitter for iPhone,True,en,1412,0
False,1240825530175324160,129123804,"Sri Lanka cabinet will release 8 BILLION for the 2020 General Election and only 0.5 BILLION for Corona Virus eradication! In other words, we don't care even if you die as long as you vote us back in! Yet people are gonig vote the same!  #lka #Covid_19",Twitter for Android,False,en,1604,3
False,1240825542150152193,1183247945057087488,1-  #italya and #Spain health system are really really really really  really bad?2- #Germany has the cure?These numbers are weird!Germany’s population can’t be mostly young people.#CoronavirusOutbreak #Corona #CureCorona https://t.co/Yv0jN6tERd,Twitter for iPhone,False,en,67,0
False,1240825611544920065,212284407,"Now I know why my cat has a daily routine. To keep himself sane.“What dud you do today?”“‘Dud,’ exactly.”#corona #coronamemes #coronavirus #coronavirusmemes #dailythoughts #spring2019 #thissucks #bored #cat… https://t.co/nGp6Lys92Y",Instagram,False,en,2714,0
False,1240825640468668416,33748765,"Captured from the City of #LosAngeles FAQ on Can and Should Not for #LosAngelesLockdown effective midnight tonight, with a 24 hour grace for businesses to ramp down. From: https://t.co/jjdJurGrFiThat's my #COVID19 tweet of the day. Stay safe all 💚 https://t.co/mguo4SHGVo",Twitter for Android,False,en,18934,1
False,1240825653328408576,72478004,I keep wondering what’s the update on corona in African countries? Not much updates from there . #CoronavirusOutbreak,Twitter for iPhone,False,en,1350,0
False,1240825761784791045,58880944,Dora 6 months into quarantine after not exploring 🤣(P.s i need to get out the house asap)#CoronaVirusChallenge #Corona #CoronavirusOutbreak https://t.co/bJsx02onjB,Twitter for iPhone,False,en,70750,1
False,1240825763344953345,139639456,Impacted by #coronavirusindia Junior Artistes Reach out to #SalmanKhan .@BeingSalmanKhan #coronavirus #corona #CoronavirusOutbreakindia https://t.co/F8xKS2Snjg,Twitter Web App,False,en,21104,0
False,1240825830579638274,1027278846,Seriously!!!!! #coronavirus #corona #CoronaVirusUpdate https://t.co/Dc7z5shY2A,Twitter for iPhone,False,en,205,0
True,1240825848141434881,1198265434623135744,"One of the best articles discussing realistic #coronavirus scenarios. Read this, and share. Stop the #panicdemic#QuarentineLife #COVID #COVID19ON #StaySafeStayHome #FightCOVID19 #StaySafeStayHome #coronapocolypse #FridayThoughts#corona #stupiditykillshttps://t.co/O1g6qzlw9G",Twitter for Android,False,en,4,0
False,1240825868924137479,968845525847085056,"I had a little bird, her name was EnzaI opened the window &amp; influenza #COVID19ON #Covid_19 #Corona #CoronavirusPandemic #COVID19NIGERIA #CoronaVirusInNigeria #QuarentineLife #FightCOVID19",Twitter for iPhone,False,en,912,0
False,1240825882677104640,2463873786,@Acyn Just like @TuckerCarlson does every day when he denies climate change.  The same scientists warning you about corona virus are warning you about climate change only #foxnews can't make money off #coronavirus so they've finally given up conspiracy theories.,Twitter Web App,False,en,263,0
False,1240825909017563139,802042941959045120,"If you have #Covid_19 and get bit by a tick, it could turn into Corona with Lyme.  #StupidJokes#ThursdayMotivation",Twitter for iPhone,False,en,79762,5
False,1240825961739956224,96440969,"California closing down many places to help its citizens avoid the corona virus, and Florida is like party on!!!!! #florida #Covid_19",Twitter for iPad,False,en,6214,0
False,1240825977019568128,754885325596438528,Please take the necessary hygiene precautions and ensure the community's safety and well being is a priority.We pray that everyone stays safe during this outbreak. Lets fight this together! #togetherwearestronger #stadvisory #brunei #malaysia #corona #covid_19 #socialdistancing https://t.co/pJSQpvk6Sz,Twitter Web App,False,en,2,0
False,1240826006530928641,705156285247967237,Jesus and his Technicolor Corona Nightmare Coat.#Coronavirus#TrumpLiesAboutCoronavirus https://t.co/yhPKmPXClF,Twitter for Android,True,en,72300,0
False,1240826034338975744,1036842435400355840,@anuradhasays @PChidambaram_IN Y he is stuck with this does he willing to windup the Democracy #GodiMedia_ShutUp #corona #COVID19,Twitter for iPhone,False,en,1980,0
False,1240826236668186624,1118733495931531264,Thinking of flying to India? Not sure of travel restrictions? Click here to learn about all current restrictions: https://t.co/xlH6US63EU--#luxurytravel #covid-19 #coronavirus #covid #firstclass #firstclassflight #firstclasstravel #premiumeconomyclass #economyclass https://t.co/Vie7MnCekV,Hootsuite Inc.,False,en,6,0
True,1240826248680452101,188078397,There are three times more deaths PER HOUR of diabetes than ALL deaths of #COVID19 to date. Y’all should be more scared of that soda can than the f***ing corona virus. (Did my own math. Stats from CDC https://t.co/BkcWbXFY6W),Twitter for iPhone,False,en,19744,0
False,1240826277625503744,961716640013537280,"""China lied about the mortality rate""*The news a few days from now#Qanon #Qanons #WWG1WGA #WWG1WGAWORLDWIDE #Corona #CoronavirusPandemic #coronavirus#Maga2020 #ItalyCoronavirus https://t.co/RZTBvtEfd4",Twitter Web App,True,en,281,17
False,1240826283531153410,1004637219716521984,Corona virus is teaching us a lesson in mutual responsibility. It is forcing us to recognize the painful fact that we are interconnected and interdependent the world over.#Burr #Covid_19,Twitter Web App,False,en,366,0
False,1240826331539156992,35406465,#Day4 of #homeschool #Homeschooling2020 and we are setting up the computer and laptop for distance learning which starts on Monday.  🤞 went for the easier math and there were less tears 😅 #CoronavirusOutbreak #CoronavirusPandemic #Corona,Twitter for Android,False,en,9407,0
False,1240826419883769856,1180465515002810369,"#CoronaVirus A friend of me have Corona VirusHe was working at DailyMotionDoctors said, he may R.i.P.",Twitter Web App,False,en,344,0
False,1240826437273337856,252823784,"How far back did Trump know ?? The moniker #Covid_19 might be a time designation. #Co corona #vi virus #d december #19_AD    @CIA would’ve known, being on ground, in #Wuhan . When @CIA ? November ? When did @GinaHaspell1 go to @USCongress ? #intelCommitee? #GangOf8 ? https://t.co/CumpQ7mTg8",Twitter for iPad,True,en,3655,0
False,1240826435134160901,1198784134593822720,@NYGovCuomo LEGALIZE MARIJUANA FUND #Covid_19 #Corona #LegalizeIt,Twitter for iPhone,False,en,95,0
False,1240826472295587842,2185768027,Some of the people that were interviewed look like that shit already... 😷 #coronaVirus https://t.co/oNlUoaIwPL,Twitter for iPhone,True,en,15533,0
False,1240826484475990017,837835026066718722,"The real question is.... if i smoke weed, will it show up if i get tested for the Corona Virus? #CoronavirusOutbreak #COVID19ON #QuarentineLife",Twitter for iPhone,False,en,891,0
False,1240826496756912134,223684544,"Be Responsible in COVID-19 Coverage. For any suspected cases of COVID-19, please contact this hotline immediately at +675 7196 0813.For Corona-virus Information Travel Advice visit(Link): https://t.co/LpPbmiKYgm and also to stay up to date.#pngtourism #Covid19 #tourismstrong https://t.co/6ejQ2REQ8o",Hootsuite Inc.,False,en,4804,0
False,1240826505300791301,1240822772776960000,What I figured from corona virus and quarantine measures is that my whole life was already quarantined. Nothing new! 🙄#coronavirus #QuarentineLife,Twitter for Android,False,en,2,0
False,1240826521364938753,1446503713,"POLL for work: do you find it insensitive/inappropriate for people (of any age) to be posting vacation-like pictures with the captions “corona time,” “coronacation,” and “thx for the time off, corona?”I know my feelings, but don’t want to sway any opinion. #coronavirus",Twitter for iPhone,False,en,27173,2
True,1240826537043099648,1393346582,Good News!@jaredkushner making money onLife &amp; Deaths of #coronavirus w/brother @JoshuaKushner @karlieklossOne more Con by Wonderkid Grifter#JaredKushner@POTUS #POTUS #Trump #MAGA2020Landslide #KAG2020LandslideVictory@SenateFloor @HouseJudiciary#KushnersProfitOffCovid19 https://t.co/2IcA3OC2Eo,Twitter for Android,True,en,13884,2
False,1240826594685411328,2847647228,I support Hon PM @narendramodi’s appeal for #Resolve and #Restraint to prevent the spread of #Coronavirus and as an united nation we all must follow the same on 22nd March from 7am-9pm. Please spread the message to everyone and let’s defeat corona virus together.#JantaCurfew,Twitter for Android,False,en,489,0
False,1240826642286559235,21143377,"This is why California shut down and until these kids get it, we will have serious issues in our country! I remember i didn't get it at this age until my mom slapped the #$%# out of me and i changed forever! #coronavirus usa https://t.co/qzGGqTGO5B",TweetDeck,True,en,7148,8
False,1240826649601589248,846210311631851520,5 Pieces PM2.5 4Layer N95 Face Mask Respirator https://t.co/750TnICqmj #ad #coronavirus #corona #virus #CoronavirusOutbreak #COVID2019 #CoronavirusUSA #pandemic #SARSCoV2 #china #wuhan #flu #CoronaOutbreak #COVID19 #COVIDー19 #PPEShortage,Buffer,False,en,5151,0
False,1240826703825510406,25903919,West Virginia confirmed cases of novel corona viruses doubles overnight: click to get the details! https://t.co/XGIa3K0s4S #coronavirus #covid19 #nexstardigital https://t.co/APSKwopd12,SocialNewsDesk,False,en,1895,4
False,1240826761379749888,1120409860061974531,Please seek the truth. Jesus is the only way to eternal life.#coronavirus #corona #covid2019 #covid19 #coronavirusitalia #covid19italia #covid19usa #covid19us #covid19uk #covid19fr #covid19esp #coronavirusespaña #coronaoutbreak #socialdistancing https://t.co/IkCEwGQWf7,Twitter for Android,False,en,250,0
False,1240826948638642178,77780136,Myth busters by @WHO https://t.co/HgXSgr8ERq#CoronavirusOutbreak #COVID19ON #Corona #CoronaVirusCanada,Twitter for Android,False,en,36739,0
False,1240826954745446400,3252405024,"The lonely burial of an Iranian doctor who lost his life after interacting with the #COVID19. Dr. Mahdi Variji was laid to rest as a ‘martyr of service’, next to his father who was a martyr of Saddam’s invasion. May God bless their souls #Corona #COVID19 #Covid_19 #COVID https://t.co/nFDYZOWsJF",Twitter Web App,False,en,18,0
False,1240826964837117953,447388917,"Cuz: Yo Cuz, How does that 🍵 work ? Me: Hey Cuz...like this...🔼🔼🔼🔼Thanks to the Corona Virus #covid_19 ❗❗❗❗❗❗❗❗❗❗❗❗TLC's   Digital Starter Kits are FREE....yes FREE FREE FREE FREE FREE all you have to do is… https://t.co/KKOBsteqtY",Instagram,False,en,2239,0
False,1240826984466395136,1160713547304751105,This Corona pandemic worst than an unplanned pregnancy🤰🤷‍♀️😭#coronavirus #CoronavirusOutbreak #CornavirusSA #CoronaVirusChallenge,Twitter for Android,False,en,36,0
False,1240827012614426624,95553259,Y’all are using the word “millenials” wrong. #corona #coronavirus,Twitter for iPhone,False,en,1971,0
True,1240827047234228224,951588735279357957,"Catching Up With @officialmcafee Talking #Corona Virus, #MarshalLaw, The #Election' &amp; #Conspiracies, Plus He Licks His Own Shoe! @Loggiaonfire @theemrsmcafee @KIFSCrypto @ricecrypto #Covid_19 #COVID #Bitcoin #Crypto #China #Spain Link: https://t.co/NOQ2UNixlU https://t.co/2tNy3DQGZy",Twitter Web App,False,en,4322,10
False,1240827070483218432,32339805,"@morss_alex We also have to think about this problem in times of the Coronavirus. https://t.co/2vMuJG3D7V @MinPres #Schiphol, #klimaatCrisis, #CoronaCrisis #KLM #Shell #Coronavirus @marjanminnesma @Klimaatzuster @LarsBoelen @Karl_Lauterbach",Twitter for Android,True,en,14211,0
True,1240827100413562880,1368673652,"Good night everyone , hoping to wake up on a miracle that one of the scientists around the world found the cure. #corona #covid_19 #miracle #pray https://t.co/96fbAdI8mh",Instagram,False,en,589,0
False,1240827147914301441,4858324135,Do these five things to protect yourself from coronavirus.#corona #coronavirus #helpstopcoronavirus #who #google #india #world https://t.co/RmoCX3esAI,Twitter for Android,False,en,161,0
False,1240827148748771328,355355662,"It is possible. But it could also be worse or better. So basically, no one still don't know what's the end going to be... #CoronavirusOutbreak https://t.co/zfN4l4PMy7",Twitter for Android,True,en,1036,0
False,1240827160786395136,1056850669,#COVID19: Government created WhatsApp Chatbot on #CoronaVirus. It is called MyGov Corona Helpdesk.▪️Just save on WhatsApp 9013151515 and you will get automated response on queries related to Corona-National Pharmaceutical Pricing Authority https://t.co/gTdaT8yUam,Twitter Web App,False,en,607,282
False,1240827187068108801,1143276947163832323,Har Stefan Molyneux en poäng?#CoronaVirus in nations with minimal #bordercontrolsFRANCE - 9100ITALY - 35000SPAIN - 17100GERMANY - 13000Corona Virus in countries with strong border controls:HUNGARY - 73POLAND - 325ISRAEL - 529RUSSIA - 147,Twitter Web App,False,en,836,0
False,1240827240964734976,51668697,"How to Lepas from Cops during Corona 101:Police: Have you been drinking tonight sir, I can smell alcoholMe: That would be my Hand Sanitizer sir, it's alcohol based.Thank me later guys.#corona#COVID19 #StayAtHome",Twitter for Android,False,en,1310,0
False,1240827269473611777,415227651,"Maybe if I told the corona virus I had feelings for it, it would leave.🤨 #COVID19",Twitter for iPhone,False,en,13725,0
False,1240827364323536898,961716640013537280,Get ready for the new virus America!!2021 Virus season will be a blast!!#Qanon #Qanons #WWG1WGA #Corona #coronavirus #CoronaOutbreak #Maga2020 #TrumpPressConference https://t.co/GPRpFkg54a,Twitter Web App,True,en,281,14
False,1240827373114646530,3009855498,"State Visit of Corona Virus of India to begin on 22nd March 2020 at 7 AM, it will be warned to leave by clapping &amp; banging utensils at 5 PM on the same day, and the Virus will depart from India on the same day at 9 PM. #CoronavirusOutbreakindia #COVID19 #Covid19India",Twitter for Android,False,en,1164,13
False,1240827379414700032,15991175,"#Coronavirus How many thousands are trapped in a similar, terrifying situation? (There’s not even a way to know how many!) *shudders* 😔 https://t.co/wya8jV9hBX",Twitter for iPad,True,en,22061,0
False,1240827479398535169,88363826,Social distancing ... old friends group chat. #COVID19 #SocialDistancing #Corona https://t.co/ZNuivGtHFd,Twitter for iPhone,False,en,3940,0
False,1240827538793852928,984339751644823552,Humble request... 🙏🙏To follow this instruction for be caution against Corona #COVID19 https://t.co/jTvSQ0NPgy,Twitter for Android,False,en,66,0
False,1240827547522199555,976876848041857026,Everybody need to Get Negative To The Results Of Corona Virus to be Positive.@PMOIndia @realDonaldTrump#CoronaVirusUpdate #CoronavirusOutbreakindia #QuarentineLife #GoCoronaCoronaGo #CoronavirusOutbreak #COVID19 #FightCOVID19 #handwashing,Twitter for Android,False,en,7680,0
False,1240827548092657669,1080718161106763776,"Wash your hands and keep them away from your eyes, mouth and nose❌This is a #kpop like song by the Vietnamese Health Department about the corona virus and how to wash your hands. So clever 🎵corona corona🎵https://t.co/ONUrZWDHyG#COVID19 #WearMask",Twitter Web App,False,en,94,0
False,1240827608524181504,6882702,"Do not panic about #Corona #Covid19There are medical force fighting in hospital.That doesn't mean you should be over confident and feel free to roam around anywhere. #StaySafeStayHome #DontPanic #DoNotOverConfident about ""I""#SAFE_IS_SUPERHERO@AmitHPanchal @RjDhvanit",Twitter Web App,False,en,428,1
False,1240827607798575104,1225676372409905157,"That corona bitch is a hoe! Bitch body count is over 100,00..someone needs to handle her hoe ass! #coronawhore #COVID19 https://t.co/n30fWZsV5V",Twitter for iPhone,False,en,82,1
False,1240827702917005312,757880609695989760,#COVID19: Government created WhatsApp Chatbot on #CoronaVirus. It is called MyGov Corona Helpdesk.▪️Just save on WhatsApp 9013151515 and you will get automated response on queries related to Corona-National Pharmaceutical Pricing Authority https://t.co/squbqMhT3W,Twitter for Android,False,en,23391,0
False,1240827750316797952,976876848041857026,Everybody need to Get Negative To The Results Of Corona Virus to be Positive.@PMOIndia @realDonaldTrump#CoronaVirusUpdate #CoronavirusOutbreakindia #QuarentineLife #GoCoronaCoronaGo #CoronavirusOutbreak #COVID19 #FightCOVID19 #handwashing,Twitter for Android,False,en,7680,0
False,1240827756516200451,1138222572267606016,FROM THE CLASS OF 2020:Count your days hoe #corona F**k you and EVERYTHING YOU STAND FOR-Shaun #COVID19 @CORTLYNSELESTE https://t.co/aELq0qU4p5,Twitter for iPhone,False,en,4167,1
False,1240827756364976128,1634751464,"#JantaCurfew #socialdistancinglife #CoronavirusOutbreakindia #CoronaVirusUpdate #CoronavirusOutbreak #COVID19 #COVID let's fight together, defeat the corona https://t.co/hubtOYmtaT",Twitter Web App,False,en,540,0
False,1240827847763247104,2712592512,Corona theme manipulation#corona  #covid_19 #photoshopart #mjsniper #youtuber #manipulation @ Laxmi Nagar https://t.co/eCDs3Oavhk,Instagram,False,en,157,0
False,1240827903719419910,39743812,In Pics | #Coronavirus impact: Cities under lockdownhttps://t.co/tiTOWHCKSk,TweetDeck,False,en,395,3
False,1240827942868889601,1578264330,"""A more complete—and, hopefully, less severe—picture of COVID-19 will likely emerge as the outbreak continues, testing capacity increases and data are refined. Until then, stay calm and keep washing your hands.""https://t.co/yeTLB5C6LB#COVID19 #coronavirus",Twitter for Android,False,en,18832,0
False,1240827987794092032,168312780,A ‘Booop’ a day keeps the Corona Anxiety away #dogsdoingthings #coronavirusau #coronavirus #staycalmpatyourdog #coronaanxiety https://t.co/2ibC4C5siX,Twitter for iPhone,False,en,512,0
False,1240827993926352898,35864244,How do I start a corona victory garden without going to the store? Legit question #COVID19,Twitter for iPhone,False,en,761,0
False,1240828031108816896,20268602,"Do you concur doctors? What about the cases in China that were re-infected? Is it a diff corona virus or were they a false negative test thought to have been recovered but never did? My biggest anxiety is the  uncertainty of re-infection, #neverendingvirus #Covid_19 https://t.co/FE9PWShRLE",Twitter for Android,True,en,169,0
False,1240828052487061504,2487409446,Good News! #COVID19: Government created WhatsApp Chatbot on #CoronaVirus. It is called MyGov Corona Helpdesk.👉Just save on WhatsApp 9013151515 &amp; you will get automated response on queries related to Corona-National Pharmaceutical Pricing Authority.#IndiaFightsCorona https://t.co/X6AwMzOVbR,Twitter for iPhone,False,en,11089,8
False,1240828056329019398,4194848603,yuuk #berjemur #moyan tiap pagi 🌄🙋get the sun ☀fight this corona together 👭💪🤲#Covid19 #VirusCorona #StaySafe #BeHealthy https://t.co/P78GsqnYQf,Twitter for Android,False,en,1404,0
False,1240828085735272448,1036842435400355840,@EdanYago Analysts #GodiMedia_ShutUp #corona #COVID19,Twitter for iPhone,False,en,1980,0
False,1240828094618849280,295685314,The difference between “social distancing“ and “stay-at-home”: https://t.co/pAZaWFVoAU #LA #COVID19 #SaferAtHome #56%ofCalifornians https://t.co/2FA2AqD9Vx,Twitter Web App,True,en,1900,0
False,1240828123538690054,112918653,California is on lockdown..next 🙆🏽‍♂️#corona #CoronaVirusUpdate #CoronaVirusChallenge #CoronavirusOutbreak https://t.co/c0BrAreD7F,Twitter for iPhone,False,en,7099,0
False,1240828166240780289,20908378,Last updated: 2020-03-20 02:05:02+00:00GMT  Coronavirus [COVID-19]    Cases: 245612    Deaths: 10048#corona #coronavirus #COVID19 https://t.co/nzj9hV0avn,rate_twitte,False,en,27,0
True,1240828236050968578,754887867214639104,https://t.co/vCq1Z2FRz8Very important site about what we can and cannot do during this #lockdownCA #CoronaVirusUpdate #COVID19 #LosAngelesLockdown,Twitter for Android,False,en,9967,0
False,1240828245756411904,982411422905778176,#COVID19: Government created WhatsApp Chatbot on #CoronaVirus. It is called MyGov Corona Helpdesk.▪️Just save on WhatsApp 9013151515 and you will get automated response on queries related to Corona-National Pharmaceutical Pricing Authority https://t.co/c7UH3NMW1F,Twitter for iPhone,False,en,541,4
False,1240828243986571267,56024815,"We all should wear masks until corona fever is over. It may not help from being affected but, it will not spread exponentially if we all wear masks. So, governments equally focus on producing masks alongside their other efforts. #coronaVirus",Twitter for iPhone,False,en,228,0
False,1240828272981823489,27721634,"The Office meets the global Covid-19 reactions! theofficenbc #corona #covid_19 #quarintine @ Metairie, Louisiana https://t.co/jZexOdAW2P",Instagram,False,en,328,0
False,1240828278878789632,1195195862265151488,please copret janta carfew on 22 march 7 am to 9 pm all people take rest in your home and callping 5 m for corona senani and take care your society #coronavirus,Twitter Web App,False,en,51,0
False,1240828292460150789,22586525,"I just want to say, I know everyone is blaming  the Chinese for the Corona Virus, but, I truly believe it’s because Jessica is 34, and Mark is 24. #LoveIsBlind #COVID19",Twitter for iPhone,False,en,55,0
False,1240828331328598017,1321210424,"#corona #coronavirus #COVID #COVID19 @realDonaldTrump #InsiderTrading while #WeThePeople r sick+dying, &amp; #shelteringinplace.""Doing a heck of a job,"" Trumpy &amp; Co.#Broadway #musicaltheatre's🎵#MadameGuillotine🎵  provides #catharsis:https://t.co/nYCGautlAF https://t.co/esHBhOD6iH https://t.co/vpUaNI6Ib8",Twitter Web App,True,en,785,0
False,1240828364979503104,1217304376869441537,Have hope! It does not matter if it’s covid-19 or someone let you down or your injured or what ever earthly suffering. Have hope in the lord! Don’t doubt just believe!-#spiritualcris #corona #covid_19 #spirituality #spirit #soul #jesus #jesuschrist #jesuslovesyou #god #go https://t.co/piqVm839KQ,Twitter for iPhone,False,en,5551,0
False,1240828391940595712,3363421274,The scariest thing about Corona Virus is that we are going to the “extreme” to make sure the number of cases slows down. This means that we will have to maintain that “extreme” or else it will only get worse! Just like in 1918 with the Spanish Flu! (1/2)#COVID19 #COVIDー19,Twitter for iPhone,False,en,101,3
False,1240828414082322436,1146066764159045635,"What Coronavirus Symptoms Look Like, Day By Dayhttps://t.co/jFLTDa1XGE#corona #coronavirus #coronavirusupdate #covid19",Twitter for Android,False,en,9568,0
False,1240828455735848960,1036842435400355840,@EdanYago Sorry din c #GodiMedia_ShutUp #corona #COVID19,Twitter for iPhone,False,en,1980,0
